text,author
if the cheating happened during a marriage i would say take some time for yourself dont be in any rush to get into another relationship treat it like a death you need time to grieve the loss and when you feel ready then you can get back out there if you were just dating this shouldnt be causing you so much angst that youd be averse to ever dating again this was one scummy person out of thousands you will meet in your life time millions of people cheat and as many get cheated on it happens we deal with it and get on with living its not the end of the world why are you letting him insult you this is a person who loves you id hate to see him when he doesnt like you i suspect he wants you to do better so you will have more money to bail him out with you know this but you are doing just fine you can pay your bills support your kid and,AuthorB
really can buy whatever you want if not right this minute but with some planning stop giving him money and do not move in with him ever you will be stuck paying for it by yourself after 7 years youre finally getting tired of this i wouldnt have lasted 7 days be honest with yourself here he absolutely is not going to wake up one day and be secure enough that he will stop this behavior so you either put up with it or you break up hes way too insecure to have any middle ground first off dont change anything fundamentally you for anyone second you said youre studying for med school so use all this extra free time to do just that but get out at least for a bit every day take a walk study in a park coffee shop anywhere else than where you live third youre young but not a child you started dating as a kid tho idk what you did that he thinks you hurt him so,AuthorB
bad that he doesnt want to date anymore but it does not matter this breakup is not totally your fault so stop thinking that way there will be others you will date and break up with use this as a lesson to not lose yourself to a partner fourth get back in touch with the friends that you let fall to the side if you did indeed lose them from studying too much they should understand fifth stop studying so much there is a point where it doesnt actually help studying is for review not for learning the material this all will pass and be a distant memory you will look back on and wonder why you ever wanted him so badly to begin with yup me too they wanted to make it look like she was and harry lobbied for her but the palace said no way then your wife had all the time in the world to pick him up from school and she should have plus your d was away and,AuthorB
its a perfect time for some mom son bonding time your son is 13 hes going into some crazy years your wife should take those rides to and from school as an opportunity to just talk to ty about whats going on in his life and if that includes james even better they do say car rides are the best way to get kids to open up i think theres no reason you should have known who was picking up ty since im guessing your wife stays home with the kids and usually does the school runs but if your wife is home why is your 4 yo at grandmas for the last month since you had discussed not letting him have too much contact with your son i think it was short sighted of your wife to allow him to pick the kids up for weeks weeks i think for this instance you two need to figure out what to do together and tell ty together honestly i think a good talk about,AuthorB
what he says and where its said should be enough what kind of punishment can you give for a kid saying stupid stuff but whatever but i also think you and wife should discuss that shes going to need to dole out the discipline when the issue happens and im not talking punishments im talking correcting bad behavior when its not even so bad so that it doesnt get bad this isnt 1950 where its wait until your father gets home because people now feel like every day has to be a good one a magical day where their partner makes them feel special at all times their lives have to be picture perfect their partner the perfect one the proposal and marriage have to be planned down to the last detail and one little bump just ruins the whole thing its all so superficial that is not reality a lot of long relationships are quite mundane but nobody wants to stay thru that to get to the next special moment but the mundane,AuthorB
makes the special that much more add to that the sense of entitlement it seems people have everyone cannot have the dream job and make a million dollars so they can buy the biggest house and the most expensive car so people basically are unsatisfied with their own lives so they feel they have to jump from one person to the next looking for someone else to make their life satisfying married 30 years since our 20s and it just works because we are ok with the highs and lows we just take what comes and deal with it you sit back and take stock of whats going on in your own life then you decide am i going to let my life be dictated by others or am i going to take matters in my own hands leave the emotion out of it no issue is ever solved by the heart you need to use your head in this instance you get mad id be thinking who the heck does this person think,AuthorB
they are to treat me badly when ive done nothing to deserve it hes obviously up to no good im not gonna sit here and take it im out he can do whatever he wants but im not sticking around and watching and then you say that loud and firm this isnt a discussion its a decision its your decision ok so you know exactly what kind of person he is do you think you deserve to be talked to in this way do you think a partner has the right to demean you to get what he wants why are you still entertaining being involved with him this is a person who has denied your existence to his family based on his religion im gonna guess and say his religion probably would frown upon him asking for nudes to get off to that in itself is so disgustingly gross to me that id cut contact with him he sees you as less than and you have allowed yourself to believe it tell him,AuthorB
to take a hike find a real man who will treat you with dignity and respect have you ever met this guy and by that i mean have you ever lived in the same place and actually dated and are long distance due to one of you needing to move you find std meds and you didnt ask what he was taking it for did he willingly tell you he was going for an std test and you didnt ask him why he felt the need to and hes checking himself all night and again you didnt ask what he was looking for do you two even talk to each other yeah you know whats going on you guys have been together since youre teens its run its course ill be honest i would not continue dating him drugs are a hard no for me you say youre ok with coke at a party but really its never going to stay at just parties and hes already tried heroin after 2 months im more,AuthorB
curious tho about how he just picked up this little habit did he just wake up one day and say hey think ill use coke today and see how it goes if hes addicted its really really hard to break the addiction he will relapse he will lie are you prepared for this major upheaval in your life the highs when hes clean and the very low lows when he relapses the in and out of rehab id tell him he has to do this on his own for himself when hes clean and has his life all back together then to give you a call and you can see what you want to do good luck its hard to see someone you love struggle but its his struggle dont make it yours so the story i just read his lawyer argued he was mentally ill no mention of being autistic so that had no bearing on why he killed sorry i agree with the judge he should never see another day free he,AuthorB
was 20 so even though technically a minor whatever law you mentioned shouldnt apply to him as he must have been tried as an adult whats to question youre a boy you are were attracted to this person who presents as a girl therefore you are straight now this person says theyre a boy but they still look like a girl so youre still attracted and still straight does this persons family know they think theyre a boy did you ask them if they think theyre a boy are they gay then since they presumably like you and youre also a boy still not going anywhere romantically just be friends ok i have to ask are you straight and thought you were dating a girl or are you gay and thought you were dating a guy if youre straight then obviously you cannot date this person because they think they are a boy and you are not into boys if youre gay then you can date this person because they think theyre a boy,AuthorB
except for the fact that they look like a girl and you arent attracted to girls this is going nowhere romantically just be friends since you seem to get along so well then it wont matter if theyre a boy or girl how old are you two how is it that your salary is all of a sudden not enough what did the two of you change has rose explained why she never told you about being pregnant otherwise its going to be a very awkward dinner but i think youre trying to do the right thing its up to rose to realize its what her d wants sorry but she knows the real reason she doesnt want to have sex and its not stress or low self esteem she would have had to been super stressed every day for the past 5 years and really a lot of people will use sex to combat stress if she still has self esteem issues after being in a loving committed relationship for 5 years then,AuthorB
shes got therapist level issues that she needs to address you two need to have an honest to a fault discussion about this ill bet shes probably more asexual than she will ever admit to you because shed be afraid of losing you but you cannot sustain a relationship without honesty especially on this subject maybe just stop lying have a sit down and explain you are so close to being an adult and you have to start making choices for yourself if they turn out to be bad so be it but at least you did it and learned from it and idk how your schools work but if you dont know history or geography how are you going to be allowed to actually graduate there has to be some minimum grade you have to get and if there is and youre making it just tell him that too your bmr might be off if youre using the same number from when you were 250 lbs recalculate it you do realize that your,AuthorB
sole job is not to make him happy of course in a relationship each person makes the other happy but not from doing every whim the other has also you are your bfs first gf from what you wrote he didnt seem to have friends either and didnt leave the house much he didnt have the usual date around as a teen figure out all the dating rituals etc idk how you two met or why he was finally able to connect with you and have a relationship that might not bide well for the two of you as he may feel like he missed out on dating around and sleeping around plus most first relationships do not work out long term but those are usually had as a teen which he didnt his idea of having threesomes may be his attempt to experience others without losing you hell get to sleep with others and having 2 permanent gfs might be way of dating around hell have to navigate more than just one personality,AuthorB
im probably reading too much into it but thats the first thought that came to mind i agree its sad almost i buzz my ha hair and i told him when he has nothing but a horseshoe we have to think about shaving it but i would not just not say anything but who knows maybe hs happy with it while i absolutely agree it is monumentally stupid for a 17 yo to have a car loan i suspect there was a lot more going on op says son wanted to live with mom almost full time so i suspect dad gave in to the car if not more just to keep son happy and not hate him and lets not forget mom probably had a hand in that decision also its not just dad he put money away for college and cars its not that the money he gave them to invest was going to be the only money they had for college some kids are spenders and some are savers and no,AuthorB
matter how much talking showing and giving advice they will not change until they are faces with the consequences son can still go to college he just doesnt have the option of any college he got admitted to his list shrinks due to money issues remember too that d is making up the diff between what the parents saved for them which would be what they are willing to pay or can afford and the actual cost out of her savings yta massive come on dad as much as you are scared about what is happening with your wife double that for your son he is losing his mother the one person who has always always been there for him so instead of coming together and trying to hold both of you up you get mad because he didnt clean his room really how important is his room right this minute give him a break and im sorry but i dont understand the significance of the hair if someone could explain please the minute,AuthorB
he told you to delete a friend for any reason is the exact minute you should have broken up with him when are young people going to understand this its irrational its jealousy and its controlling i say let bf pick whoever he wants as best man maybe ask your bf why if sb is such a bad person it would mean so much to him to be there is there more to the relationship between sb and bf that means so much to bf was sb good to him at a time in bfs life when he needed someone was sb a mentor for bf something anything then i would take that into consideration also it just seems odd that sb is pretty much hated by everyone but your bf isnt really seeing that and i wonder why bring back the hat and rename back to hollywood studios we still call it that anyway weve been going since 94 and dont even remember that hand sign i had to look it up to,AuthorB
see what it looked like i dont like it then youre going to have to remind her of the agreement to not be in the room while you work maybe include in that convo that her anxiety seems to be getting bad again and she should start getting a handle on it now before it gets bad enough that her school and work will suffer maybe suggest she start looking for a new job now if she loses her job or quits will you be able to afford it dont wait until shes crippled with her anxiety to decide to address it at this point just swap rooms with her she can set up her school stuff in the br this way if she wants to stay in bed all day she can and if she wants to do her schoolwork she can also it seems like shes going to either quit her job or get fired so you might as well give her the bedroom now so when shes home all day you,AuthorB
wont be dealing with this every day her motivation is to just hang on to you long enough for you to marry her then shes all set honestly i would be embarrassed if my date showed up to a family thing so woefully underdressed but only if i have already explained what the vibe of these parties are did you explain this to her if you did and she still made no effort that would be a big problem you didnt pressure him into not telling his family but you also only told him when you were 5 months along im sure he knew how could he not but it seems odd that you seemingly confirmed the pregnancy and was im guessing all excited but you didnt share it with him did you share this news with anyone he didnt get to have that surprise reveal from you and share the excitement im curious tho what family traditions of his does he not agree with my dermo told me to just moisturize them like,AuthorB
thats gonna help i remember as a kid there used to be a commercial for age spots i think it fades them im thinking of looking for something like that but i cannot remember that exact name tho i had to go back to make sure but you are 16 you have years and years and years ahead of you to find that special person are you expecting to meet someone now that you will stay with forever its not going to happen teen romances very rarely last your teen years are for figuring out all this dating stuff so ask out any girl who seems to be nice cute or have a same interest as you and stop worrying so much desperation is not attractive at all you dont think youre attracted to her so give it one more date dont discount that you two could just be friends if you enjoy her company heres how i look at it as long as my partner is just looking and not engaging with any,AuthorB
of these people especially if they dont even live anywhere near us i dont have a problem with it there are so many other people who could tempt my partner right where we live that i really am not going to be jealous or worry about a picture on a screen its basically harmless but thats just my personal feeling pretty sure anyone who reads a newspaper or had any form of sm knows about it and talked about it we heard all about it talked about it speculated about it waited for all the details to finally come out and we got a list of people who flew in a plane virginia guiffree got her payday andrew is relegated to scum of the world je is dead and ghislaine is in jail what more is there to say no one who was kidnapped or trafficked has come out in public and accused anyone else im not even sure they named anyone in any kind of sealed legal documents sometimes relationships just run its,AuthorB
course she was 17 when you started andnow shes an adult she wants to do all those things that she missed out on that all her friends got to do while she just sat on the sideline and watched i think its absolutely gross that she called you and basically told you she cheated on you and was planning on taking this random home that alone would make me lose any feelings for this person so dont concentrate on what you lost concentrate on the fact that she didnt even have enough respect for you to have a conversation about the fact that she was doubting this relationship and needing some time to decide if she still wants it she doesnt want you shell go play around for a while and is expecting you to be there when the grass isnt greener dont be that guy block her on everything youre worth more than that wait the dad didnt want one what did the wife want cause the fact that her best friend wanted,AuthorB
one and they had it is extremely bizarre to me maybe its a good idea that his overbearing parents step in and actually get all of them on the right path even if hes depressed he seems to be able to do the farm work he just starts much later than most farmers but if he got to sleep at a decent time he should be able to get started after he puts the kids on the bus talk to him and his parents im sure the parents know this whole situation has to change and if theyre so overbearing i cant really see how they let it get so out of hand i dont think youre too involved you care about his family and only want whats best doe them i think youre trying to get him to be more responsible about his farm and getting the work done no if thats the case just waking him up isnt really going to help unless he stays up and does the work who is,AuthorB
working his farm i think you need to have a serious talk with him if you guys were so close what happened when did fam dinners stop when did you stop working for him you said the behavior changed a year ago so what was it like prior to that and where are the kids mother does she not see them at all does she also just let them do whatever he needs to get his kids on a better schedule his 4 yo should not be up till all hours of the night what is he thinking by allowing this and his other 2 need more sleep than they are getting talk to him explain your concerns if you are as close as you say he might open up and explain whats going on with him is it possible for you to talk with his parents about the kids schedule or the state of the farm do his parents not see what is going on why do you want to get past this,AuthorB
hes been doing this stuff for 6 years what makes you think hes going to stop see heres the thing as i see it yes she cheated and that in itself would be a reason to stay separated and ultimately divorce but you have to also realize that you werent a model partner to her either you lost your job over drinking and im gonna assume when you drank you werent exactly a great husband to her now i am absolutely not saying you drove her to cheat or am i excusing her cheating im saying that you two should both just cut your losses and split up at this point there are just too many issues that neither of you will ever be able to forgive forget or get over get some help for the drinking its no way to live and her affair partner can worry if shell cheat on him thats not your problem any more thank you now i understand what ppl mean when they say it can i ask,AuthorB
what they nickel and dime you for i hear the words im reading in my head but i actually read too fast and find i dont retain what i read sometimes so i have to purposely make myself read slower and if i dont understand what i read i read it very slowly out loud pausing to make sure im getting it im curious tho have you tried to purposely read faster what happens do you retain the info i love that you know that much history of your family have you been back to hungary to meet your relatives still in the village there those pics are so classic 50s america i dont necessarily have a problem with these materials being shipped they have to be shipped somehow but id like the rail companies to have an emergency response team that is always ready to jump right in if something were to happen an approved maybe regulated plan from outside the company preferably good job on the script that way nothing gets taken,AuthorB
out of context and you say all that needs to be said and i never meant to imply anything dangerous or reckless about the weed as far as the baby goes just saying its not the best in the long run for his problem ah big ones i searched quick but didnt find anything helpful so id say go to the er but id tell them they passed out the same day that way its an emergency and they have to treat im sorry i hope your relative will be ok while i agree you cannot make him go and get help i would have one more conversation about it frame it as this we have a child we need to make sure we are at our best for them if you wont get help for yourself at least do it for our child its not healthy that your child will grow up seeing dad have a panic attack every day and its not healthy to self medicate with marijuana ive got nothing against,AuthorB
it it just ultimately isnt going to solve his problem its just pushing it down the road tell him youll go with him to any and all appointments until he finds a dr or therapist he likes id ask friends neighborsanyone for a recommendation and id call and explain his apprehension and ask them to please use kid gloves with him what kind of work up did the dr recommend i dont know about the er but id be surprised if they would do a work up there im assuming a work up would be like a check up with labs i found this tho specifically look at the medical walk in and wellness in metuchen it seems they are free and will do a check up which usually involves lab work idk how the lab work would be billed tho maybe give them a call and ask explain what happened and what the dr said we need to know why your son has seemingly cut contact with you until he needs you to,AuthorB
sign over the car depending on why the no contact im not so sure id sign over the car since you had to pay off his sallie mae loan are you sure hes paying off his car you might get stuck with that too but i also agree i would never ever sign a blank document if youre going to sign it over id make sure to fill it out first you should know all then i do its asking for and take and keep a copy of the filled out form this is what i did and i am absolutely no expert by any stretch but this will at least help you to get an idea of how to get started go here this will give you an idea of how many calories you need to maintain your weight then subtract 25 of that amount and aim to eat that each day get a food scale to weigh everything then i just planned out what to eat for bl and dinner for the,AuthorB
next 2 or 3 days i went shopping so i had everything i needed to stick with it i very rarely eat breakfast just coffee but i almost always had a huge salad for lunch with tomato olives carrot cucumber and a protein the protein was either left over chicken from the night before or even just a can of tuna in water i did add dressing but a low cal and never more than 2 tbspns dinner was 3 or 4 oz of chicken fish or beef and vegetables and a small salad lots of vegs and water was the only thing i drank lots and lots of water snacks were portioned out nuts or a string cheese or just plain carrots have a glass of water before you snack to see if you really want to snack or if you just wanted something it seems daunting at first but you will get used to it pretty quickly but weigh everything i even weighed out teeny amounts of carrot and celery for my,AuthorB
salad a lot of times it ended up being like 6 calories but i still counted it you can do this just dont try to be so militant crazy to start because you wont stick with it its ok to be over your calories when you start but you want to be over by 50 not 500 i would cruise alone but make sure to go to the solo traveler meet up on the ship go meet other solos these would be the people you can hang around with on that sailing and you might get lucky and find one or two who you get along with and can plan future trips with i wouldnt trust rooming with a random stranger im a little confused about justin hes not the babys dad we know that you met him when you both lived in diff states and somehow he just decided he would be dad and you allowed that then you break up and he still wants to be dad even going as far as,AuthorB
