text,author
without giving reasons or excuses anything you say about why you cant will just be the beginning of a debate or manipulation instead tell her the truth you wont youre not going too whether you can or not is not a necessary conversation because youre done lending money you may try to say consider the past money a gift but i will not lend money any more that might soften it and make you feel better since that is reality the reality anyways but accept that if she chooses to respond badly than she just will respond badly nothing you can do about that your job right now is to make yourself feel secure and comfortable saying no and sticking to it you cant really control how she chooses to react youre being ridiculous you shouldnt go to the wedding because youre fucking ridiculous and the happy couple really shouldnt have to deal with your bullshit you need to get over yourself if you really cant manage that on your own seek therapy its,AuthorC
been over a decade you were children this should be vaguely awkward and kind of funny it should not be anything more than that pretending that you were destined or that you had any rights to her or that you have any ability to not let this happen is all completely absurd im dead serious if you are actually this distressed about the situation please talk to a therapist this is not a healthy or rational response youve agreed the cats are hers the cats are hers the care of the cat is no longer your responsibility and also not something youre entitled to if she believes a contact with you of any kind will help the cat adjust she can i ask for your help with that however its probably far better for the cat to push through this adjustment period then to have intermittent and unreliable contact with you you just need to grieve this relationship that includes grieving the relationship with the cats if you believe your girlfriend is cognitively incapable,AuthorC
of empathy and has no regard for right or wrong dont date her drugs may be contributing but they are not the sole cause your bf is abusive its not your job to protect him from the neighbours knowing hes an abuser its his job to not be abusive go to the wedding alone and then make a plan to keep yourself safe and away from this man ask your family for help hes gonna hit you soon or worse he is abusing you and hes justifying his escalating abuse the only thing that stopped him was the embarrassment of the neighbours finding out he didnt stop because he didnt want to hurt you he stopped because he didnt want to get caught youre in very real danger gather up your important documents and have a friend keep them or mail them to your parents you were right to run keep running dont take your coworkers so seriously they probably arent seeing much they are more likely bored and using you two for entertainment,AuthorC
which is another thing you need to put a stop too by not giving it any more fuel stop spinning out on this like you said in the end you just have to step back there is nothing else you can do that is appropriate given the place your own head is at you need to start just saying no and keeping your distance one of two things is happening here 1 she is truly obliviously and genuinely trying to build a friendship with you and is open to opportunities outside of the workplace to do that so you need to end it and say no to those opportunities clearly because youre not happy or comfortable with her version of friendship and thats okay as with anything you can admit that a friendship connection isnt working for you and step back from it 2 shes looking to cheat with you so you need to end it because youre entering into a situation that can only possibly harm you with someone who is untrustworthy youre,AuthorC
reading an awful lot in to passing comments made in the workplace youre quite clearly overinvested yourself in the fantasy of her wanting you but the truth probably lies somewhere in the middle shes unhappy and not fully aware of what she is doing or thinking through what she is saying odds are good you are taking this far more seriously than she ever has the end result is the same tho stay away just be the bigger person and say im sorry to have hurt you our relationship was important to me but ive accepted it is over given how you feel about my choices to move on and date again i think its best we not continue to try to be friends good luck then block her she has no business berating you and you know it maybe she isnt trying to manipulate you but it doesnt really matter this isnt going to work as a friendship if that how she feels or how she behaves if she is going to be,AuthorC
this upset by the reality then youre not friends and you can end contact if you do not want to be in a relationship with someone who uses drugs frequently and to excess then hes not your person what is capable of is lying to you he is capable of lying in repeated obvious and predictable ways he is displaying the behaviour of being an addict and being in denial about that the odds of this getting better are slim the odds of it getting better before it gets much worse are basically nil if you go back in two weeks you will be in this exact same position again quite soon with an addict who broke their word again when it came to substance abuse this is entirely up to her if she doesnt wish to be in a relationship right now that choice is hers and needs to be respected depressed or mentally ill people are still entitled to end relationships breaking up isnt a choice you make together its a choice,AuthorC
one person makes and then its made it doesnt require your belief or your agreement if she wants this to be over then its over for any reason even reasons you dont like or agree with its nice that you believe you can be a source of support but in any relationship if one person chooses to end it its over youre her bf right now not her therapist or social worker or any other adult participating in her care or treatment you dont work together on serious mental health challenges you offer the support you can as a teenage bf and she can accept or reject any of those offers tell her you dont want to have any contact or conversation with someone she thinks might kill her if she wants to make up crazy stories act accordingly dont apologize tell her to stop putting you in danger too no i dont want to talk to your brother you told me he might tell your dad to kill you dont send photos of,AuthorC
me to potential murderers are you trying to get me killed as well you cannot fight that kind of crazy narrative so lean into it next she calls him tell her youre gonna talk a way and dont tell the people who want you dead that i live here please dont diagnose dont recommend a treatment plan you havent got those skills or information there is a level of whiteness that is within normal and the bacteria that causes bad breath isnt removed by scrapping the colour change is more likely caused by whatever is causing the smell instead of the cause itself of the smell or the smell might just have you noticing something that was always within normal for him he really shouldnt just start scrapping his tongue raw it may do nothing or he might make things even worse for his health instead tell him the fact that you do know his breath is bad and its getting worse ask him to please to speak to a doctor best option likely,AuthorC
a dentist about how to address it you cannot stop him from investing his portion tell him plainly this is not what you want for your future if he rather not buy right now that is a totally valid discussion but it needs to be a discussion with you his actual partner if he will not do that and it seems he has already decided not too you have learned that you need to financially plan for yourself and yourself alone he is not your partner when it comes to money he is not working with you you need to decide if the relationship can move forward or even survive with that limitation its okay to be mad but dont delude yourself into thinking you can fix it if you had a screenshot of that conversation that would be far more relevant to share with her than his more recent attempt at contact the choice is yours personally i dont police other people being shitty in their relationships i only stick my own neck,AuthorC
out if they are being dangerous and i have clear evidence of them being dangerous to date what you have here is bullshit not dangerous too many of the people who date casual shady assholes and liars just turn on the people who try to warn them no reason in my mind to open myself up to harassment or drama just because your bf is an asshole just block him the core problem here is that you dont want to speak to him hes not your friend you want him out of your life so get him out and dont insert yourself into the drama and court more contact and conversation with him or with his gf that is always a risk a risk of not being believed or even of being harassed in response and that is the opposite of what you actually want im all for taking that risk and telling a partner when there is some physical danger or harassment like cheating or blackmail or threats but here there is nothing,AuthorC
but bullshit lowkey opentointerpretation bullshit its just not yours to carry its not on you to do the work or take the risk to inform her of this sort of shit just be done with him your bf thinks youre trash and he feels entitled to treat you that way you were not stupid you just assumed that your bf didnt still think you were trash he does he always has he has always believed this about you and he will always believe he can treat you as if you were trash whenever it works for him the problem here is not about seeing your friend the problem here is your bf and its not getting better its not going to get better he feels entitled to weaponize this against you whenever he wants to lash out at you he will use this he will always shame you over this he believes he deserves to treat you this way as long as he continues to behave this way this is not a safe relationship,AuthorC
for you nice to hear a happy story with a partner who listened and stepped up thank you for sharing you need to change the password on your amazon account or disconnect your card or use a prepaid card you also need to seriously reconsider this relationship and the agreement youve come to with your wannabe trophy wife you cannot afford a trophy wife getting a joint account with this woman would be insane not caring if she contribute financially to the cost of your life together isnt laudable if you have negative funds in your account its just kinda stupid in other words you left really important details out of the op but they dont really change my advice hes bad people okay still her choice who is in her life and who isnt and not yours still something you need to speak up about respectfully and decide not to date her if you cant deal with her choice still an overreaction to i dont know youre responding as if she said definitely,AuthorC
yes were having coffee tomorrow and if my current bf told me it made him sick to think about me having sex with my ex id tell him to get the fuck over himself and stop fixating unfairly thats immature and unkind you keep arguing with her about her own experiences its fine to disagree but this condescending towards her like this isnt going to help her deal with her own past its fine to let her know how youre feeling but dear god rein those feelings in and bring more respect to the conversation stop making her past all about yourself yeah but he also has to do the work to not make it personal that is literally the bare minimum he needs to be doing here out of basic human respect you can and should expect better from him than the behavior youre describing anxiety makes controlling yourself more difficult at times but it doesnt mean hes not still expected to meet the minimum of respect and kindness hes not meeting that,AuthorC
i have a rather severe anxiety disorder and id never dream it would be acceptable to treat my partner the way he is treating you while you drive youre overreacting i dont know needs to be a valid and safe response to that question its fine to tell her that you rather she didnt its fine to be uncomfortable its not okay to loose your everloving mind over this its good for her to remember that you can forgive someone and not be mad at them without inviting them back in your life its vital you remember that she is entitled to choose her own friends and should be trusted to maintain appropriate boundaries with all the people she chooses as friends if you cannot trust her to do that dont date her boundaries yelling watch out for anything short of immediate risk of death is not acceptable behaviour for a passenger likewise boundaries against accusations are valid and important here he can be saying things like this feels fast or im uncomfortable with,AuthorC
the speed he should not be saying youre speeding his feelings are what he needs to communicate not his anxious assumptions or accusations about your behaviour he needs to recognize and use his words to reflect the fact his judgments in this situation are flawed and unreliable he is not that authority compromises you need to accept that time in a car is not together time instead of framing it as a chauffeur id recommend you think of driving the two of you places as a chore like doing the dishes or vacuuming one that is difficult or impractical to share but necessary to keep life going on your chore is driving his chore is managing his own shit while you drive so at that moment youre not together you both have taken on separate necessary tasks to get to a place both my partner and i have anxiety around carsdriving these are very similar to the boundaries we have in place when one of us is the passenger no spoken warnings unless they,AuthorC
rise to the level of someone is gonna die we both agree not to give a damn about scratches or dents on the damn car we share feelings or ask questions we do not assert facts or make accusations we respect the person behind the wheel is doing one job and the passengers job is to not interfere or make the driving job more stressful than necessary and sometimes depending on anxiety levels the passengers job is the harder one but just as necessary as the drivers that it be performed well as someone who loves you i want better than this for you you dont need to go much further than that to start i wouldnt suggest you get prescriptive and tell him what to do but you might ask him as someone who loves you what hed suggest to you if you were calling him each day with these concerns and anxieties about a partners unkind words or drinking the opinions to voice here are the opinions that your father is kind,AuthorC
and worthy its not your job or your place to address her addiction or mental health its your job to tell your father youre concerned for him and that you want better for himself than he has right now tell him this is not okay hes no okay he deserves to feel okay in his relationship this isnt a financial question its a relationship one you actually have two choices 1 continue to date this woman 2 or dont you could certainly be speaking to your gf about your plans for the future and how she might sharejoin you in those you can be speaking about the compromises and agreements you would not be open to making yourself like living with someone who financially supports a parent her choices are only relevant to you so much as they change your relationship together and introduce stress or impediments and the solutions really are hers to figure out not yours to prescribe she needs to be the driver seat on any suggestions or next steps or,AuthorC
it just wont work the choices your gf actually has are far more than two and 500 is likely not reasonable rent in any way dont know how you pulled that number outta your rear its your choices you should be considering and in the end youre the one who really only has two this is definitely unpopular but i hate how the quote wellbehaved women seldom make history has been twisted and misunderstood and turned into a slogan because the author was actually making a super cool and way more interesting point about whose stories get told it wasnt a battle cry to misbehave laurel thatcher ulrich who was a professor of early american history at harvard said this in an academic paper on new england ministerial literature 16681735 basically it was about early american settler women writing about their faith she was arguing womens lives have limited representation in historical narrative except as the bad girls and that wellbehaved women should make history that their ordinarydomestic lives were interesting and worthy and,AuthorC
that we shouldnt be trying to classify every woman who ever lived as either housewife or radical anyways it makes me cringe every time i see it plastered as a slogan on some alternative fashion or warrior princess vibe or misattributed to marilyn monroe dude just no go touch grass read a book or something about people who actually did survive refugees natural disasters read academics and historians takes on settlers early societies or exploration this is tv often fairly called trash tv and i love it but this is purely entertainment those commenters those clips are part of the attention marketplace there is nothing to study there not in the way youre describing youre confused about what is taking place youre not talking about serious thoughtful considerations about human survival when youre talking about any particular seasons groups performance on this show youre talking somewhat ironically about gossip an often femininecoded but deeply human practice of casual conversations about other people typically involving details that unclear untrue or otherwise being delivered through the,AuthorC
lens of deep individual bias lets maybe not conflate a single season of reality tv with an experiment season three of the same silly show would tell a different story and gender boy and girls alone paints a very different picture but i really dont think we can learn to much about human survival from an extremely small group of people who self select to be on reality tv then are further selected by producers for good tv and who all know damn well the stakes measured in clout and bragging rights not death yeah when it gets that extreme it a few bad apples situation imo i imagine most men could correctly deduce that a doctors office is not the place for this behaviour even if they were inclined to it but it only takes a few men to spoil womens experience of being approached and lord knows its way more than a few who feel 100 entitled to the attentions of any women they see straying into a public space my go,AuthorC
to is now is a perplexed shake of my head and a loud i dont know you this is not a conversation ignore all questions all insults dont take the bait just wait till they stop for breath and say i am not having a conversation goodbye men who feel appropriate amounts of empathy and shame are much less likely to be cold approaching to begin with ew no id be done with this therapist hell i might forward this exchange to thier supervisor there are a handful of what i can most generously refer to as rookie mistakes here the observation and advice to ask him explicitly to stop might be a good one especially if the therapist is going to back you up on boundaries and tone and help to keep the questions productive but the blame shifting and enjoying the attention remarks were so totally beyond the pale once someone said that to me id be saying thank you for the sessions i will not be attending any further no explications,AuthorC
or justifications they have utterly closed the door on any actual communication or understanding here dont try to smash through it just say no someone who thinks i am attention seeking is not someone who can be trusted with any vulnerability whatsoever we are adults seeking serious assistance not toddlers or puppy dogs who are bored youre not refusing treatment by ending this relationship youre leaving a situation where you are not respected or believed by the authority figure in the room dont blame yourself for not stepping up early it seems likely you had properly judged the situation as not one where it would be safe or productive to do so this kind of specific examples but my life got so much better when i realized yes a lot of men do not likecannot handle a woman making the first move but i dont want to date those men anyways so loosing my chance with them is a perk not a failure lets start asking out who i want to ask out and,AuthorC
stop the attentionseeking games to signal availability sure a study if 75 women including 15 who has never had intercourse asked to judge from 33 3d printed blue wands landed on a general preference for length m 63 inches and circumference 48 inches so if youre buying a blue dildo for the average woman you now know what to look for if youre looking to drag other men down into despair and anger with you this is scant evidence for a slight aboveaverage preference amoung woman and also please stop hey maybe we should just not have a draft maybe that is like fundamentally immoral and unworkable and weve all basically agreed on that by now anyways no threats of violence we need every possible delusion and excuse to shame women with vague threats of violence and harm against them and were totally cool with fucking over men just to get to keep those insults they are only conveniently unable to decode the women they dont wish to listen too when other men they,AuthorC
value or fear or respect behave in passive aggressive or indirect ways they understand just fine they pick up on those codes constantly every day because they decided it was worth it to do so they are not as dumb as they would like us to think a person women or often gay men who seek out very large penises or toys careful research watched a lot of porn made for men by men concluded women are the problem actual research less than 20 of women orgasm from penetration alone and an even smaller number identify as size queens is this woman your friend if not tell her to take up her boundaries with her husband all you did was show up at a party you were invited too in your work clothing then block her the boundaries in her marriage are not your job to know or enforce if she has an issue its with her husband do not apologize for existing in a dress if she is your friend then tell her,AuthorC
you are sorry that her boundaries were inadvertently and unintentionally violated by you but that anything more than that is an issue between her and husband not you or the number of male firefighters who are also convicted serial arsonists then say that its on him and maybe encourage op to keep herself safe if he doesnt acknowledge that immediately because without that accountability spelled out your advice appeared to be that op should set themselves on fire to keep the poor wounded adult man who is abusing her warm you realize you sound like a 19 year old and honestly thats fine be a bachelor be the emotional equivalent of a teenager if that makes you happy sit at home and wank and pay your taxes thats fine but stop allowing this woman to hold onto any false hope or expectations of you youre being a selfish shit if youre leaving her with any hope of you ever moving to be with her youre not gonna do it not all but defiantly most,AuthorC
eh there are 21 million content creators on only fans they are not all women they are not all american and less than 20000 of them make more than 50k a year in other words barely 1 of the people on of make their living on of this woman is a moron its been weeks they are 22 please leave the hes just hurting but you could save him bullshit at the door only visits twice a year i think and gets homesick after a week or two doubt he has a key she just has to block his number fingers crossed for her if he doesnt have a problem being parentified like this there is nothing you can do but accept and support his desired role in the family this is not meticulous this is also not nearly as complicated or difficult as youd like to pretend you dont want to do it thats real simple youre stalling youre stalling because youre basically comfortable with how things are currently and youre waiting for,AuthorC
her to be miserable enough to end it and accept that you have no actual intention of living with her its not okay its not decisionmaking youre describing its been ten years youre firmly in place of refusing to make a decision youll excuse me for being so clear about it but stop being a cowardly selfish little shit and end it this is ldr is working for you but not for her it shouldnt be a battle she shouldnt be begging you it shouldnt be years of indecisiveness stop stalling she ought to dump you but you also ought to acknowledge the reality and ump her end this because you acknowledge you are not offering her what she keeps on telling you she needs and there is really no sign that is going to change at any point then talk to her about what shes looking for and stop being a beligirant ass about it the way you describe handling the above is a really good way to find yourself shocked when your,AuthorC
