text,author
night connecting as a couple ah see i learned something new thanks for the diff between the two ah learned something new today thanks for the distinction excellent point this is a key distinction i perceive antisocial with being more aggressive maybe at or when meeting new people but someone who is or shy or introverted is just more uncomfortable amongst new people but willing to go out of their comfort zone to make new connections big diff in advice to be given they wont let you bring them on when you board and they will take them from you when you reboard and store them from you until the end of the cruise if you buy them in port so basically no but i heard if youre cruising europe you can bring alcohol on when boarding and also from ports that they will let you keep but you should confirm that get a library card and use their app to borrow ebooks for your kindle this way youre not paying for books you,AuthorB
might not like how about reading the book of a movie you enjoyed theres usually a lot more nuance in the book that you cant get from the movie and you already know you like the story that might make you more willing to set aside time to read no its fine but do you understand the point i was trying to explain trying to explain why trans ppl get more hate than just lgbq people what youre missing is the baker wouldnt make a cake for the lesbian couple because he was religious and said it goes against his religious and moral convictions idk anything about the gender one tho but im guessing probably the same reason but thats a guess its not a matter of not agreeingwith lgbtq at this point we all should know that there are people who have diff sexualities but trans ppl arent as simple as a diff sexuality they are in a whole other place having more to do with gender than sexuality so i think that,AuthorB
confuses people who dont understand how that can be so its as if they dont understand it it cant be true in a sense adding to that is young and really young kids claiming to be trans and all the medical treatments they are being given at such young ages doesnt sit well with a lot of people theres a feeling that its too much too soon is it right or wrong i have no idea then add in all the controversy of what bathroom to use sports competition moral issues like the baker and other businesses situation and it just becomes an us vs them fight and this is what were seeing now i liked it im not a huge fan i knew some of the songs i thought it was simple but at least for the most part it focused on her just doing what she was hired to do sing her songs i liked the floating platforms and the dancers around are were really good but i also dont like when,AuthorB
theres so much else going on that the main act kind of gets lost in the shuffle when theres too much going on all at once sometimes the camera is one place and other things are going on in other places that way you dont really see the whole production the problem i see is that youve only been with your bf a few months you admit yourself that you do not know him well enough or know enough about him that you need to know and this is why you never should have met his kids if you start to know the things you need to and do not like what you learn and leave those kids will be sad and confused but im also confused about something is he a single dad because he seems to have his kids every day with an hour to spare to see you where is the kids mom was this how it was when you first met why cant you spend the evenings at his house,AuthorB
and spend time with him after his kids go to sleep why would you even ever entertain the thought of sleeping with someone elses boyfriend this is just plain wrong you are old enough to know that this is the cardinal rule nobody should have to tell you this stop hanging out with him alone and getting drunk no good will ever come from this he may sleep with you but hes going back to his gf thats a bit harder to fix because its an issue for you but to him its not really an issue can you maybe schedule a few days a week i know it sounds so stupid to have to schedule your sex life but at least both of you are on the same page and sometimes it works just by the anticipation also keep in mind would you rather have sex for the sake of having it or would you rather have really good sex sometimes quality over quantity also maybe dont put too much pressure on him,AuthorB
start with 2 times a week and work up to 3 or however many works but you should start to figure out if you can be in this relationship more long term youve already spent 7 years and its not easy to leave when theres so much good but you dont want it to get to a point where your resentment takes over either if its a matter of frequency then he doesnt see it as a problem because he thinks his sex drive is perfectly ok and it is its just that yours and his do not match if its more a matter of what youre doing together you need to ask why he isnt willing to experiment some people just dont like some sex acts and really shouldnt be made to do them if it isnt their thing you matched with her first but your bro was texting with her before you started dating how did that even happen you both must have been at the very least texting or talking with,AuthorB
her at the same time and how did you find out bro was talking to her look if you dont see moving forward with her just let her go why drag it out any longer so does your ex usually pick your son up at 9pm so he can sleep at dads everything about this is just off you pay your ex child support but you have him all day do yourself a favor and split custody with the ex 5050 no one pays child support and then youll have time for your bf so dont give her access to all the money sit her down and show her your finances take the 4800 for the month minus all your household bills by now you have an idea what the variable ones avg out to food etc take the net thats left and left decide how much goes into emergency fund long term savings and depending on whats left decide on a weekly amount she can use for herself open separate accounts for the,AuthorB
emergency savings and one for her money leaving is impulsive she doesnt work and you have two small kids your finances are not going to be better supporting a separate household for yourself and paying alimony maybe and child support you say all hell breaks loose when you discuss money just tell her she can bitch and moan all she wants its still not going to change the fact that she is being irresponsible where was your mom for those 2 hours you should not have to sleep in the spare room unless you want to or your gf is so sickly contagious that its dangerous for you to be in your shared bed how long could it possibly take you to hang one load of laundry and in that time your gf went upstairs got ready for bed and also fell asleep oh and conveniently sometimes puts her glasses on your side of the bed so its a guess each night either she was not sleeping yet and purposely set you up to,AuthorB
have a fight or she was sleeping and got unreasonably mad when you came to bed and woke her she really couldnt just wait for you to come up and you go to bed together thats pretty selfish in this instance considering she knew you were coming up pretty much right after her the thing you need to remember is this when we start to date we have no idea what were doing were all fumbling around trying to figure out this whole bfgf thing so we date and we break up a lot mostly with no rhyme or reason who knows what your bf is thinking but dating you just isnt working for him anymore doesnt mean you did anything wrong stop being sad look at this as a learning lesson the lesson is enjoy it while it lasts take a day or two to mourn it and move on but that doesnt mean on to yet another boy just for the sake of having a boy this too shall pass most people,AuthorB
realize that the 2 party system the us has is not working i think mainly because theres an us vs them mentality most elected officials dont think for themselves and just go along with party lines thats not to say they dont personally agree with some issues but it is unrealistic to think one person agrees with every single platform either party has and third party candidates have mostly been one off random candidates from one state here and there thats why the third party is looked at as a water vote that out of the way how does this sound a third party but with candidates in every state where an election is being held with a pretty centrist platform take the most popular stances of each issue and endorse that or whatever it is national elections take place every evennumbered year every four years the president vice president onethird of the senate and the entire house are up for election onyear elections on evennumbered years when there isnt a presidential election onethird,AuthorB
of the senate and the whole house are included in the election offyear elections so next year this third party could have people running who could theoretically change the whole look of all branches of govt im not gonna explain this correctly so bear with me how do we do this we let people in every state know that we have ppl running in all the diff states so me in state a can say i want to vote for party 3 and id like their agenda to be implemented i know one person from my state cant do anything alone but if a countrywide campaign can be implemented with a message of this party can get a majority of representatives we can implement our platform it might make people rethink the wasted vote of a third party could be that you just dont have an actual sexual attraction to that person her being good looking isnt really the only criteria maybe you need to have an emotional attraction to a partner as well,AuthorB
sex is sometimes as much emotional as physical and just wash your hands and clean under your fingernails for me its not about trying to hold the family together its more the nephew is too angry for an 11 year old and i recognize that all is not well somewhere in his life it could be his mom has poisoned him against his dad and his fam it could be theres more to the story between his mom and dad that even the op doesnt know it could simply be that nephew is a troubled child but whatever the reason if he grows and gets to a place where he wants to make amends with his dads family he will have the knowledge that they always wanted him around and never actively excluded him thats just my take if nephew wouldnt show up anyway you might as well extend the invite it keeps the peace with your brother and if nephew ever realizes that this side of the fam is decent you can always,AuthorB
say that he was included and he never took you up on it but if you can schedule on moms weekend youd be better off as an aside im still confused how his mom wanted nothing to do with the father of her childs family what did she want to happen shed raise the child alone and dad would just be ok with that dad needs to get some some help so the boy can stop being so angry nta its your money that you earned its not as if you spend some of it youre putting an undue burden on your parents the fact is even with a full scholarship there are day to day expenses that you need money for coffee with friends a movie gasetc why dont you explain this to your mom and ask for a monthly amount dont divide all the money you have so its gone by the last month of school just try to figure out a nominal amount that you can get by with youll have,AuthorB
some spending money and youll also still have some savings when you graduate unless something big comes up in the next few years i found it odd too the woman tho i heard they have more info but not releasing it just yet something about who the man is that was seen running away the other guy it seems is a workplace issue the guy who killed him was an ex employee he was a gas or electric co employee so im not sure him being an elected official has anything to do with it now if the same guy killed both then we have a story honestly he sounds a bit too controlling for my tastes but we really dont know you nor what your individual needs are so if you say his what we see as controlling but you see as taking anxiety inducing decisions off of you then maybe its not as we see it have you tried to explain to your parents exactly how him making these decisions are actually,AuthorB
helpful to you rather than harmful im getting the impression they arent seeing what value they add to your well being this is also your first relationship so you dont really know how it should work do you you have nothing to compare him against the good and the bad as far as staying home after you marry it sounds lovely doesnt it until he starts complaining that youre hobbies are taking up too much of your free time and youre not dedicating enough time on his needs and framing it as you just arent using your time efficiently be on the look out for that please thats when you should reassess the whole him making decision ideas maybe you should work part time a few hours a few days a week just to retain some semblance of independence maybe start with asking her to study or out for coffee you and she both should spend time together to see if you actually do like each other before you commit to something like the,AuthorB
prom idk any proms that are soon so im basing this off the us version of a prom dont fall back into the its ok most days tho work it out now for everyones happiness yours theirs and your child you may open a pandoras box but wouldnt you rather know that now than years from now yes you would hey im on your side i just meant not to bring up the money part of it in a i paid for it way def ok to say why are you not done yet its been 7 yrs i would never hire someone to clean thats just a waste of money when someone is home all day with seemingly nothing else to do and absolutely do not being up being able to find another partner as tempting as that may be but i would say i didnt sign up to be and do everything in this relationship i need an equal partner and i have to know if youre willing to step up and,AuthorB
be a partner or this isnt going to work for me youve gotten some great ideas how to approach the things that need to be brought up please organize and use them and let us know how it goes yeah no no way my partner would be waking up mid day thats just disrespectful on a whole other level id start waking them up when the rest of the household gets up in the morning your poor kid even recognizes that one parent is basically useless thats another point you can point out to your partner i need to sleep to get up for work and kid has in the past refused to even ask you to do a late pickup knowing you will refuse its affecting them and we cannot have that going forward its not fair to our child i wouldnt harp too much on the accounting course but it needs to be mentioned that may come off as a money thing even if its not instead of a it shouldnt take,AuthorB
7 years to finish a 2 yr program thing whoever cooks should be cleaning since they make the mess normally its the opposite but your partner seems unusually messy during cooking have that chat give yourself some time to organize what you want to say and how you want to say it you might as well just come out and ask if they dont want to be here anymore since this is the impression they are clearly giving send child out to a friends house i have a feeling this might not go so well that article was condemned by pretty much everyone that read it since i dont know what can they do to clarkson can they make it so he can never write for a paper again fine him charge him with a crime or will they just condemn it like everyone else omg yes especially when its only a few months in if youre having this many or this big of a problem after a few months just get out why,AuthorB
try to save a bad relationship laid out like this obviously the division of labor is wildly unfair im curious tho how did it get like this you didnt just move in and you were doing the lions share was it a gradual tapering off of them doing less and less did partner start out as a sahp which if chores went undone it wasnt a big deal cause child care and rearing take a lot of time but then did they just get used to not doing much this was me but any mention by my partner that things werent getting done caused some small level of guilt like i wasnt holding up my end of the bargain i wasnt being a good partner but thats just me you need a serious sit down with your partner does partner have any health issues that may be contributing in any way do they have a hobby that theyre dedicating all their time to and in a very non accusatory way you need to ask,AuthorB
what the hell they do all day while you are at work kid is in school for most of the day i can see having to drop off and pick up but partner seems to basically do nothing make a list divide the work and specify specific days of the week things need to get done theres no reason laundry cant be done every other day for instance its a nice thought but it really would not stop brandon from drinking the bigger problem is that brandon does not recognize that he is an alcoholic despite going thru rehab its normal to relapse but he seemingly has no plans to try to get back to sober and its not that you dont like the real him you actually do like real brandon its drunk brandon you dont like maybe your fianc should be having a come to jesus talk with brandon its fine if he decides that wants to be a jobless drunk but brandons friends should be able to decide if they want,AuthorB
to be friends with a jobless drunk regardless of how long the friendship has been yta im really curious why you adopted this child to begin with you already had one son when you adopted and went on to have another so its not a case of thinking you couldnt get pregnant and then miraculously did and she was no longer your only hope for a family as some may think its pretty obvious she isnt treated as a d but as an adopted d she is your oldest child why didnt she get a car and pay for her school even if she got some scholarship you think she had to take loans so why didnt you just pick up the difference do you really think she does not know that shes the not wanted child shes a part of this family in name only i wonder if you did her any favors by adopting her she would have been better off with a family that wanted to give her an actual living,AuthorB
family and parents whats the rush with this guy or any other youre in your early 20s with already one marriage that didnt make it totally understandable and youre still not untangled financially from the first guy if you were with the first guy for 3 years and dating this guy for 1 year youre only 23 you got married at what 18 or 19 this guy might be the best guy ever but maybe you should just keep your separate space for a long while longer date him while being on your own for a while so thats what you tell him im not untangled yet and im not doing anything until that gets settled and im not jumping into living with anyone until i know them inside and out and been thru good and bad and very bad but why if you were happy with her and wanted to make a life with her are you so compelled to talk to women online you must realize that makes you pretty sleazy thats,AuthorB
why shes leaving you not because of some grand scam she was trying to pull she might have been happy to leave everyone and everything she has back home for a better life with you but you didnt exactly treat her with enough respect to lay off the other women i dont really care that you never physically cheated just the fact that its been going on for the whole duration of your marriage is a testament to what kind of man you really are it just took her too long to find out this is all on you i hate saying it but youre right she should have never been alone the h knew she was having problems im sure his and her family knew even if they never dreamed in a million years she would do something like this because who would even think it at least have someone with her just to take some of the stress of everyday life with 2 kids and a newborn its just so tragically sad,AuthorB
is it possible that hes starting to think that hes leaving his 70 yo mom alone and thats why hes pushing for her to go idk if he has siblings left behind that can look after mom if she needs it has he explained why he doesnt think your mom and sister cant be trusted to come with you thats an odd thing to say is he afraid your mom and sis wont contribute financially to the renting of the property because apparently his mom wont be and hes worried it will all fall to you guys so maybe instead of renting both homes as a unit you can each get separate rental agreements on your and their home so you and h wont be on the hook if they decide not to hold up their end idk just throwing out ideas its not what they do or say its what they do or say in that moment if they shut down someone being rude snarky or harassing the first time it happens that,AuthorB
goes a long way to show people that you have confidence in yourself and arent going to take any crap from anyone you know hes kind of down in the dumps lately i think it would be a really loving gesture for you to do something nice for him without expecting anything in return you can agree to watching a movie together but maybe you can make a surprise nice dinner for you two maybe his favorite just to cheer him up or a dish you make really really well pick up a candy heart and share it as you watch the movie buy a bag of those hearts with words on them and trade them back and forth basically make a cute romantic night in express to him how much you value him for him not for what he does for you his situation wont always be this way so support him as you would want him to support you if the roles were reversed nta and congratulations you should be so proud,AuthorB
have you explained to your parents about the hs grad party and the sweet 16 and why cant they just let you have this one thing that you are paying for on your own i would text all three of them and point these things out youre not asking for anything from any of them you just want to be celebrated once in your life for your accomplishments how they respond to the facts laid out in black and white should tell you all you need to know if they should be invited or not well done india lets look at the two people in this scenario in a 2 yr relationship that is not 100 solid you readily admit to mental health issues and what you are doing to help yourself get to a better place good for you in recognizing this should be your number 1 priority she on the other hand also has some mental health issues and is doing nothing to try to get to a better place now these,AuthorB
mh issues have in some small way caused her to forget to take her pill thus contributing not solely to the pregnancy it is totally possible that she could have taken the pill perfectly and still have a pregnancy but the chances are higher by her skipping pills do you really think that two 19 yos with mental health issues who cannot afford to support themselves are ready and able to care for and raise a baby that is the reasoning you needs to speak with his gf about the actual practicalities of raising this child not your immediate feelings not her immediate feelings the actual nitty gritty who is gonna work to support this little family you her both of you then who is gonna watch the baby if you two both work how are you going to afford daycare you both work now and still cant afford to move out of your parents house can either of you earn enough to support all 3 of you rent food utilities car payments doctors,AuthorB
formula clothes etc it sounds so exciting to have a baby but the truth is its the hardest job in the world to raise a healthy happy well adjusted person because thats what you will be doing for the next 18 years and if you decide to have this baby please heed this my very unscientific conclusion from fam and friends is that women are more fertile after having the first baby so lay off her keep that in the back of your mind i have no opinion on what you and her should do i just think you both need a serious sit down to discuss the actual realities of having or not having this child have you explained to him that long explanations get lost on you that you physically cannot keep your attention on a long monologue im not so sure that eye contact is needed sometimes i have to picture what the other person is saying in order to get it ask him to break it up and check that,AuthorB
youre following him for ex first i unscrew this got it then i take this part off making sure i dont scratch it got it and on and on youll have to be honest tho when you dont get it and he may have to repeat himself but hell have to be understanding about that ah ok that clears up a lot i thought you lived with your bf family full time and that you havent been in touch with your dad for a while i am changing my judgement to yta just for asking bf to skip the wedding youre nta for being upset that your bf didnt get a plus one id be upset at that for the fact that youre together a long time and additionally your bf is an adult and a plus one is usually how invites go for adults unless no other cousins were also no plus ones im sorry if i came off as harsh wasnt my intention at all do you have any friends that you,AuthorB
