text,author
budge dont accept less than what that child deserves and that child deserve a mother who is safe and respected as well id dump you for that that is a massive violation your gf heard you out and listened to your opinion and she told you shed reinforce boundaries the next time they were crossed she told you directly not to get involved and then you did anyways that was a breach of he trust and it was also degrading and demeaning and embarrassing her friend friends probably by now not just him now all know that she has a controlling and suspicious boyfriend who doesnt trust her and goes behind her back to treat her like a badly behaving sixyearold id be so offended and ashamed if my partner did that i dont think id continue with them the first thing you do is admit you were 100 in the wrong here its fine to be concerned and ask questions of her but it was 100 wrong to contact him behind her back,AuthorC
and against her wishes you apologize for not respecting her trusting her and for doing precisely what she clearly told you not to do if you really dont trust her dont date her but never pull this shit again youd be wise to speak to a therapist or counsellor especially one with a family practice and consider what kind of role you want to have in the childrens lives that is going to depend a lot on their ages as well as their individual personalities and it also needs to include what kind of contact with your ex is possible and healthy for you i think maintaining some longterm committed cool uncle status would be admirable and probably bring some stability to the kids lives continuing to be dad in any real way would be more likely to be confusing or even dishonest the relationship needs to be downgraded but id hope youd be willing not to end it completely if the children value occasional but predictable and reliable contact with you say no,AuthorC
he cannot afford it you cannot afford it together the answer is no if you say yes you will be married by mortgage this is way more serious than walking down the aisle so if youre not ready to do that you absolutely should not be doing this this is a stupid risk you are not supporting him in this for the same reason you wouldnt support him if he wanted to go hang gliding on a frame made of silly putty keeping an open mind doesnt mean letting your brain fall right out he can either find a way to buybuilt equity with his 240k or he can wait until you both are prepared for this step tell her that you are concerned about remaining in a relationship where your gf calls you a liar and refuses to trust you or respect you when you tell her something important about how you feel its okay to ask for reassurance at times we all need that from our partners but the way she is,AuthorC
seeking reassurance from you is not respectful or kind she needs to find other ways to ask for whatever it is she needs and she has to respect your answers when you give them youre not being unreasonable do not stay in a relationship with someone who is constantly accusing you of lying to them we both knew that was the outcome no matter what i did but it is pretty funny isnt it x200b she says over the last few decades more and more women have found that partnering with men is not a good deal for them and costs them more in effort money or overall happiness than remaining single the data backs it up and it is a much more clear and longerterm trend than mgtow or the rise of the manosphere he says prove it she says i have judged this not to be worth that additional labour from me but good luck in your research here are a few pointers the data is out there and i am confident,AuthorC
in my understanding of it he says i just knew she was full of shit i dont believe you if id have believed you were sincere i would have cited my sources but i actively choose not to do that labor based on how you decided to respond to those who did an honest bit of googling is your friend if you are sincere about looking into the comparative happiness health or wealth of single and partnered people woman and men the apps dont love to give current data on the decreasing number of woman users because it undermines their marketing case to men but it can be found especially if you search for impacts of the overturn of roe vs wade on these apps if you are sincere about putting forth that effort i wish you luck but i have a job that pays me to do this sort of work and im disinclined to do it right now here for free youre repeating propaganda not data women have been increasingly leaving the,AuthorC
dating pool for decades especially women who are divorced widowed or have children whereas men in those situations are more likely to be highly motivated to find a new partner dating apps are imperfect places for information but even they are quietly reporting women quiet quitting dating in droves and the women to men ratio on the apps are getting worse and worse and the normal ratio was already pretty bad being partnered is still by in large a better deal for a straight man than a straight women generally speaking men gain support wealth health and happiness and generally speaking women loose those things are there men who are giving up on dating sure are in comparable numbers to women no that isnt what decades of data tells us the men who are quitting are just far louder about it and louder about what they feel is wrong about the world that they cannot access sex and service from women because partnership is so much less likely to enrich womens lives sufficiently for,AuthorC
them to pay the price men risk dating a bad individual women risk that plus the risk that dating even one of the good ones will still leave them more worn out and more poor than they were before you and your mother need to manage your anxieties and curiosities coming up with half baked theories online is not a good way to do that if you want to express support actual support and not just morbid curiosity then do that but your sister ended contact and its strange and a bit suspicious you just ignore any reasons for that that needs to be respected im glad youre getting support dont stay in this relationship if its not supporting your health and happiness you need a therapist not a boyfriend youve struggled to draw your own personal boundaries with this guy and his questions that was largely behaviour you should have been able to shut down yourself without needing anything but more passive support from your bf and while we all may experience some,AuthorC
anxiety when a partners friends doesnt seem to like us the extreme youve found yourself in is not healthy for anyone it doesnt seem like this relationship is working for you in some other key ways as well stop martyring yourself and get some treatment for your anxiety so you can handle things better with someone better keep working with your therapist dont connect with your ex at all youre really not being rational about this i understand its hurtful but your best path towards healing doesnt including confronting her or challenging her narrative thats literally the worst thing you can do both for your own sanity and for the risk of escalating bad behaviour i understand this is really upsetting but you need to realize this was the best possible outcome she overplayed her hand with people who knew you well enough to know she was lying nothing was going to stop her from doing this it was actually pretty predictable if youre totally honest with yourself and neither you or your friends,AuthorC
had the power to shut her up shitty people do shitty things and most of those things are totally legal but she didnt receive positive reinforcement for her behaviour thats the best thing that could have happened to discourage her from continuing that game make it boring dont let this game of lies provide any drama or validation or supply there is no other strategy for you give your friends some more grace while they may have made mistakes they were probably sincerely trying to protect you from information you couldnt handle in a healthy way and they werent wrong even now youre struggling to manage this information practically keep up with the therapy and if you need boundaries with your friends when it comes to your ex ask for those boundaries clearly im concerned what you think putting yourself out there entails that it will inevitably lead to accusations of criminal behaviour this is not about looking human beings notice other human beings bodies that is not what hes up too your bf,AuthorC
is taking steps to cheat on you thats not a guy thing thats a cheater thing hes trying to coerce you into accepting him having sexual contact or just straight up sex with others get rid of him shopping for sex workers has nothing to do with checking out attractive people at the beach or gym that like arguing that everyone snores in their sleep and you have to learn to put up with it and then punching you a few times while youre asleep and saying its totally the same thing and you should just put up with it its not the same thing i am sorry i misunderstood that being a conversation in front of him but seriously you still have to start with an apology drop it doesnt mean go have a deep heartfelt discussion with my dad which includes the private conversations taking place in our marriage where we both know you think im wrong you can disagree with your wife privately but you cannot talk about her behind her,AuthorC
back especially not with a parent and expect her to feel okay about it no matter how wrong she is that choice from you is going to damage your marriage the first thing you do is stop taking sides stop scolding her and stop telling her what she owes her wonderful father she currently does not wish to revisit the topic it would be sensible and respectful for everyone to accept that for the next 48 hours she asked you to stay out of it and you immediately turned around and told her father exactly what you had said to her that was absolutely an act of sidetaking and then you come back in and in front of her father insulted her that made you an unsafe person for your wife to come to with vulnerable or fraught feelings after the visit begin with an apology you did poorly then you can discuss how you were surprised by the amount of pain and anger she was carrying towards her father not because shes wrong,AuthorC
but because you were ignorant of it and unaware she had those feelings towards him and suggest she deserves and would benefit from unpacking those feelings with a pro if she doesnt want too than she doesnt and you let these other adults sort it out your assumptions about how she should feel or behave are not going to be helpful unless your opinion is asked for what needs to be addressed here its weirder to me that youre fixating on this as if its a problem then it would be even if your perception was accurate shes not vague posting or putting anyone on blast i eat more take out when my partner and i fight if he ever tried to address that id tell him to get bent and order a pizza if you cannot handle this date someone your own age andor someone with a fundamentally different relationship with social media it didnt read callous to me wrong to do it front of the cameras sure but we wouldnt have reality,AuthorC
tv at all without that error in judgment my dad would give me that kind of straight talk and i love him for it he calls me on my shit and as i grow up i call him on his the layers to her is that she isnt actually a very smart or clever manipulator shes tossing wet noddles at the wall to see what sticks shell grovel one day and be back to fuck off the next there is only what she wants in the moment we assume people like vanessa are brilliant and machiavellian and making dastardly moves looking ten steps ahead shes not she reactive and performative shes willful not intelligent i can empathize with her when she is hurt but it doesnt change the fact that everyone on this show or watching this show has been given plenty of reasons to just not engage with her sometimes when you treat an entire group of people as poorly as vanessa has treated so many of the people in this group you,AuthorC
dont get to come back from it youre not entitled to a second chance sometimes youre just out if it werent for the show everyone except maybe xander would cut her out for good and thatd be valid imo this this is my only read i feel like im in the twilight zone reading the op xander screams baby gay to me shes immature because yes lots of people who come out later in life are missing some core relationships skills and go through a second adolescence but xander is inexperienced not malicious vanessa is terrifying and its not the fucking edit its 9 sentences out of 10 that come from her mouth scream abuser internalized misogyny is a beast some women being shitty to other women means women are human not that shitty men are correct about all women your friend is deeply emotionally immature this kind of toxic dynamic was always a risk and you cannot fix him tell him whatever the fuck youd like about your concerns but dont lie to,AuthorC
yourself your friend is nearly 40 and hes picking this hes that kinda guy the only thing you can really speak to is the boundaries you want in the shared space steve is gonna need to figure this out on his own men know other men are dangerous most men think other men should be dangerous or are incapable of not being dangerous and then blame woman for acting on this knowledge and choosing any strategy for safety that doesnt include having sex with him like even if this was remotely true wouldnt the obvious issue be that wealthy and affluent man are hoarding 70 of young woman and yet you want to return to a strict patriarchy where wealthy and affluent men would have the full power of the state backing them up as they hoard access to women if you want women to be a commodity an object or a slave you whiners end up not being able to afford one either that or youre a commie it seems there are much,AuthorC
more serious problems here if you think this is how you need to be compensated for sticking by him and are feeling this insecure about how much he values you i think you should both talk more openly about other expenses and savings goals and if youre going into this marriage with a now you owe me attitude that is something to resolve with a counsellor first that is gonna suck for you both want what you want have your preferences it is your reasons here that are concerning even if he wants to keep this friendship its the boys who need to be doing the damn work at this point i dont know why op is so set on managing them as if they are kindergarteners in her classroom youve asked this before and the response remains the same you cant fix it its not yours to fix this is who this best friend is its your bfs job to address it at this point declining invitations is one way to address it,AuthorC
and as long as your bf keeps this person in his life this is a pattern that is likely to repeat from time to time stop taking so much on yourself youve apologized youre open to being around them thats all the fixing you can do you cannot control other people the 1987 survey of youth in custody found that 70 did not grow up with both parents internationally there is no question that children raised in single parent homes are more likely to offend but so are children raised with stepparents or with exposure to violent neighbourhood crime this is just scapegoating women who parent and the fact he takes aim at the more educated ones is particularly absurd like you said this is about poverty not the bad woman who decided poverty was better than partnership or had the misfortune of having a child with a man who choose to walk away he gets so close to realizing poverty is the problem and that toxic masculinity is behind a hell of a,AuthorC
lot of these single mothers so close its right there ready to bite him but he cannot manage it must be the womens fault the educated ones who actively choose separation whose usually equally affluent partners are actually most likely to remain present coparents to some degree the ones whose children are least likely to experience poverty and the risks associated with lower socioeconomic status its their fault not the men who walked away from women who who were much less well equipped to survive not the men who made poverty look that much better than marriage never the men i have not yet met the woman who confuses herself with a small number of bird species so he uses irrational emotional outbursts to silence your legitimate concerns and uses one long ago mistake you made to justify his ongoing poor treatment of you yeah op youre being emotionally abused the three things you describe there are the very positive characteristics of my brother he is 17 this isnt entitlement to money this is,AuthorC
entitlement to respect and transparency respect would have been a transparent conversation early on at the very beginning offering clarity that this was a shared plan not a gift and that the expectation was they would split expenses respect is not one person especially not the much higher earner declaring that all things shall be 5050 henceforth after the plans are already set in motion he didnt request financial equity he tried to enforce it over 100 so he can feel justified when he enforces it next time on 10000 again without any transparent and respectful conversation he tried to coerce her into an agreement he could lean on in the future as an absolute he tried to bully her into proving she was a not a golddigger but we all know hes probably going to keep treating her as if she is one even if she pays up not okay or at least ask his partners budget before picking a hotel for a trip he suggested exactly this this guy is treating op,AuthorC
like a golddigger and choosing to test her over 100 op has 100 understood the situation correctly and should simply decline to go further with someone who is functioning on the assumption shes using him for his money nothing she does will ever prove otherwise to the sort of man who would test like this instead of talking about at the very beginning of the planning like an actual adult its not about the money or even the income its about someone declaring the only fair way to split costs is 5050 no discussion no invitation no question of the budget prior to the plans going forward just the presentation of a bill two months in this is unacceptable this is not best behaviour i prefer to split things 5050 generally speaking but i will not date a person who declares it the only possible way to operate especially not if there is a large discrepancy in resources i have been in situations before with higherearner partners who pressured me to keep up with,AuthorC
spending because it was only fair i have also been the higher earner so i have always been extremely clear with what is a gift and what is an expectation at the very beginning of any plans otherwise its not fair it is not kind its not a respectful way to discuss expenses and i dont want to be in a relationship that involves this sort of nickelanddiming ive been there it sucks it is a small bill today because it is a test its a test to see if he can pressure her into paying without a transparent and respectful conversation about budget or expectations hes trying to create an agreement that 5050 is the only way to go so he can enforce that in the future its not an okay way in my book to approach this conversation even if splitting this particular expense makes total sense hes testing op is a really shitty way and op should feel free to fail and look for someone who communicates transparently and respectfully this,AuthorC
guy has communicated that he will probably always view her as a golddigger no matter how she behaves get rid of him i wouldnt date someone who made 5x what i did and felt that 5050 was the only fair way to handle costs that is going to lead to complete financial ruin for the lowerearner partner you know hes testing you you know hes the one who just failed dont get into a debate with him just let him know youve decided against continuing with him block him when he doesnt exhibit grace and respect you walk away shes been very clear you need to respect it you learn to manage your own emotions and stop trying to take ownershipsave her from hers minimize your contact with herthe group until you are able to behave with respect someone has sent me a video of you during a party and now im really concerned about your safety with the people you hang out with i need to ask you some questions so i can,AuthorC
know youre safe now id say that id have to it seems very obvious to me that whoever sent you this video intended to shame your bf and bully him further the first thing you need to do is be clear it did not work your concern needs to be for his safety and your clear communication needs to be that nothing he does no matter how drunk he gets validates or excuses people treating him this way do not be the tool of his bullies be clear that his safety from abusers is your only concern if he says he is stays the fuck away from those people tell him youre glad and youre proud of him ask if he wants to talk about it any further dont demand the only answer you need is that he is currently safe from danger and abuse if its selfimposed then its not a ruleagreement with your partner its a personal choice you would make for yourself with any partner but to be entirely honest as,AuthorC
a bisexual woman id still probably avoid getting too deeply involved even if you swore up and down it was entirely personal and your partner didnt even care because it just reflects that common attitude that sex between women isnt real sex youre entitled to a personal choice other people can have personal feelings about that choice consigned as a bisexual woman this implies to me that any sex and connection im having with the woman is lesser than purely on the basis of my gendergenitals a personal choice is fine and all i have lived much of my adult life with only one penis but it was never a policy it was just who was in the mix at the time and we cannot pretend these sorts of attitudes towards sex that doesnt involve a penis exist in a magic little bubble they exist in a context that id rather not operate in no the mother would likely need to be extremely illmalnourished to begin with in order to end a pregnancy this,AuthorC
way with any reliability two weeks of deprivation would be totally insufficient for most reasonably healthy adult women young wolves become way more vocal yipping and growling in ways that dont appear to be very communicative when the rest of the pack is ostracizing them for poor social graces or bullying behaviours but human beings arent wolves either okay that explains the problem more clearly but you still need to stop trying to solve it for him tell him the actual problem for you hes shown you a plan but that plan is not happening you are paying for him but he is not being honest or accountable to you hes loosing your trust and your respect stop trying to tell him how to solve it and trying to fix it for him put it back on him hes damaging the relationship being dishonest with you and being dependant on you financially its not acceptable its going to end the relationship maybe not tomorrow but eventually you will be happier and healthier without him,AuthorC
so you choose that any sane person would dont tell him exactly how to fix it remind him youve given him plenty of suggestions and you now expect him to fix this problem not continue to make it yours if that direct talk about consequences and boundaries does not get get him moving on this within a few days start planning to be rid of him if the problem is him and hes choosing to keep those problems and make them yours too then you have to solve your real problem by getting rid of him hes told you he doesnt want help hes shown you his plan you can disagree but if he had a plan and hes working it you need to stop pressuring him to make a better one its his plan and he may be right about what the limits of the charitycouncil powers are and its not your business in the least if he doesnt want to ask his parents for help if hes paying his obligations to the,AuthorC
shared home then you need to let him carry his personal burden the way he chooses too and speak for yourself speaking for yourself can look like i dont have the bandwidth the listen to these complaintsstress right now or even i find it hurtful you continue to complain at me but will not entertain any of the suggestions ive given you at all speak for your own feelings stop trying to fix the situation for him its his if hes not paying his agreed on share of your shared home then you need to consider that this isnt a safe person for you to live with because he expects you to carry his burdens without having to listen to you or consider your feelings or perspectives at all this it makes me so mad when kids are taught this was the highest of high art and was inaccessible or highbrow rj literally opens with a bunch of teenage buddies making a rape joke a rape pun but so many teachers just swan on,AuthorC
