text,author
i think its silly not to accept what is basically market rate from your gf,MLeek
if you stick to your plan and shes truly not comfortable with it then shell simply end up paying more elsewhere anyways,MLeek
you might also consider connecting with any schoolscolleges in the area and trying to find a short term lodger 36 months i did this a little while to supplement my income but so as not to commit to anyone long term where i live they also pay a bit more and if there is a serious problem you can let their school know,MLeek
its just compatibility,MLeek
telling the truth did exactly what it is supposed too,MLeek
it was better to find out now than later that you were youre going to be incompatible with lots of people for one reason or another if you were incompatible in this way its absurdly unlikely that you were magically perfect for another in all others these things tend to spill over,MLeek
ah thank you you too,MLeek
although in all honesty mine is so far behind me now i really dont look back at it with anything a sense of humour and gratitude that i stayed basically safe part of current awesomeness,MLeek
my little brother made the mistake of pulling this women wouldnt fight in ww3 bullshit on us last week,MLeek
he has type 2 diabetes asthma and is nearsighted he will have a desk job every single one of his sisters is way way more likely to see combat than he is,MLeek
i dont know who the imagine that housework is being done for like just for ourselves would be grand but not economically viable the exact opposite happened last time industry ramped up the women went to work,MLeek
im sorry you went through this it does suck but it really wasnt about you it was all about him being able to keep the mask up until anything was expected of him besides easy words,MLeek
am i right to assume his divorce was really resent and hes still very bitter and inexperienced at living alone cause women his own age probably wouldnt touch him with a ten foot pole if he was acting this way they would definitely bail the moment he accused them of being emotionally abusive  like his ex now you know as well what to listen for take the lesson but dont take it personally its not about you its about him still performing his old toxic patterns  hes not trying to avoid them in you he was trying to enforce them on you,MLeek
can see why this man is a divorcee who picked an ldr with a woman a decade younger than him,MLeek
dont take it too personally be proud of yourself for confronting him on his shitty inconsiderate behaviour that took some stones its not a cultural thing it a selfish person thing tell him its over and then block him dont bother trying to explain anymore im sure his exwife told him over and over again until she lost her voice,MLeek
no shaming of sex workers or sustained celebrators intended,MLeek
i remember my hook up years when my standards were rock bottom and i was chasing self worth through dating and casual sex,MLeek
and 3 new men a week who could string a sentence together and brush their damn their teeth while also working 50 hours and being an adult impossible absolutely not happening not one week ever not if i spent every waking moment swiping and chatting,MLeek
i know a few sex workers and i dont think even their average week includes three new clients,MLeek
our bodies dont exist except as products on a shelf,MLeek
thats gross i really hope that is an esl issue because this is not a respectful way for him to speaking about these women and it sounds like both have some difficulties with respecting the women in this sport,MLeek
if you sincerely believe your partner is targeting women in his sport to perform violence on them when hes angry with you then you should not date him,MLeek
we cannot read his mind any better than you can if that is what you think of him and his temper act accordingly,MLeek
no you cannot find out you have trust and respect or not,MLeek
if you sincerely believe your partner is targeting women in his sport to perform violence on them when hes angry with you then you should not date him,MLeek
because that appears to be what you are saying and you must see that is an insane thing to think about a person and then stay with them,MLeek
except you dont not when you assume hes letting them win or they are fundamentally of less value to him as a competitors than a man would be respect isnt a claim its a practice,MLeek
do you want to be an athlete and wrestle with men,MLeek
if not then yes that is a possible hypocrisy but its also picking a fight about something you dont even want for yourself anyways,MLeek
you need to get a grip if you trust him trust him when he tells you what is normal in the sport he practices,MLeek
you are misunderstanding a culture which should be rooted mutual respect and sportsmanship  and often is you are underestimating how much skills can matter and you are severely underestimating these pro woman no one is letting them win,MLeek
women participate in the sport with men and his explanation is plausible with nothing else to go on these women deserve your respect as athletes,MLeek
the issue here is not the sport,MLeek
if you otherwise trust him and your conflict resolution remains healthy and productive i would advise you to let go of this entirely,MLeek
love it,MLeek
even if we assumed every single woman on of was an active creator of sexual content and was an american woman between 18 and 35 ya still get 19 of roughly the 55 million american woman between 18 and 35 with an of account,MLeek
and they arent all american or all selling sex and only an even smaller minority are active so even with the most generous take on this its less than 2 roughly the same percentage of women who leave their christmastree up till february,MLeek
strange way to tell us that the algorithm knows youre not interested in content from women unless they have an of,MLeek
all in all youre dating a person who doesnt have much bandwidth or skills to deal with a normal disappointments and daily struggles in his own life  and judges and mischaracterizes your struggles because of his own limits and lack of awareness he may not be consciously projecting but it doesnt really matter end result is the same even if hes not malicious about it he has been consistent about telling you what support he can offer and consistent in his refusal to seek treatment,MLeek
hes not being consistently kind youre not compatible,MLeek
as a 25 year old who has embraced treatment and learned the skills she needs to find success in her own terms you probably actually have less in common when him than you do many neurotypicals,MLeek
you apologize,MLeek
you acknowledge youre both angry and that being angry with him for not waking you wasnt entirely fair,MLeek
you admit that while its not his job you probably should be asking him for the favour of the occasional wake up  because you have a medical condition you cannot perfectly control thats not making it his job that is asking for his support with something that isnt his job,MLeek
and you probably have to do some listening to some frustration and unhappiness he has as well hes probably pissed too and hes got about the same rights to it as you do,MLeek
and then you probably talk to your doctor about some sleep aids if youve already done everything you can on your own to manage your sleep hygiene,MLeek
yeah youre the asshole here,MLeek
if he had agreed that on this one day he would wake you by x time so you two could stick to your shared plans then youre be justified in being angry with him for not doing so,MLeek
but thats not what happened what actually happened in the vague plans kept on shifting and he didnt really know what was to do when you fell back asleep he likely felt rationally that he was gonna piss you off regardless of what he did he didnt have information to act on feelings are not instructions or directions to be woken or left to sleep,MLeek
right now youre pissed with him for not doing something he didnt agree to do which you didnt ask him to do and both agree he fundamentally shouldnt be expected to do,MLeek
being disappointed in the situation is totally fair being angry with him was not youre both frustrated with something medical right now that neither of you can perfectly solve,MLeek
you need to ask for what you need clearly i would suggest in the short term being clear with him that if youre sleeping through commitments with him you would appreciate him waking you up so you can keep those plans,MLeek
he cannot be your human alarm clock everyday but he can and should be able to come and get ya when you two have agreement,MLeek
thats not totally fair,MLeek
men also use it against men when its convenient to them to argue that all men are biologically programmed to be unfaithful or sexually violent,MLeek
the loss part of this is what is wildest,MLeek
any halfway sane woman hearing that would be calling a lawyer and opening accounts without his name on them people loose their jobs all the time someone who raided the family saving account to immediately pay off their employer is not just getting laid off,MLeek
this guy seems to thinks loving him means turning off your rational brain and walking joyfully in to the jail cell beside him,MLeek
i have this theory that women arent bullying one another enough anymore to create enough insecure women willing to date me so i have to get way better at lying to women to work around the amount of mutual respect they have for one another and now expect from men i tell extravagant lies like i respect you and acknowledge your value as a person instead of ugly truths like you actually have no value as a human being if i dont find you personally fuckable and available,MLeek
i fucked up at my job so badly i was fired and i was financially liable and paid it from our savings cause ya know were married its probably not just mine but no lets not discuss it further and im gonna just chill at home for the next two weeks while you panic and  hah not psych lol you should have seen your face wait why are your bags packed,MLeek
without knowing what the thing is its impossible to form much of an opinion on the risk to the relationship and if your anxiety is something you simply need to manage yourself,MLeek
your boyfriend is nearly 30 doesnt have his life together in the least has a history of cheating and instability in general and is 100 going to sleep with this woman after moving in with her,MLeek
get yourself sorted find an affordable for place for yourself and a job if youre going to school you might find they have resources to help you find a room or a job that fits with your schedule most schools want you to keep paying tuition so they may have some advice for you definitely call them and try to find someone to speak to before you move back to a parent who isnt supportive,MLeek
when youre 29 youre gonna look back at this guy at his choices and his emotional manipulation and your mind is going to boggle,MLeek
keep on loving him if you want but dont be an idiot keep your financial and home life completely separate he cant be trusted partner when it comes to money or a place to live,MLeek
dude you got rejected by someone you chatted with for a few days whose intentions were right there in her profile,MLeek
this isnt a pattern this is not a friendzoning and you are far too old to use that word,MLeek
this is a person who was always offering you friendship and you were disappointed by that,MLeek
given your feelings you should probably decline her offer of friendship,MLeek
you cannot fix this for her she needs to acknowledge it is unhealthy and do better for her own sake as well as the relationships,MLeek
and that is really unlikely to happen,MLeek
youre being played,MLeek
hes in debt deep which means you are too you need to stop the bleeding,MLeek
you flirted with an ex you did cheat anyone sane would consider that a violation of the relationship agreement,MLeek
stop being a dipshit admit what you did recognize that getting dumped for it is perfectly fair reasonable,MLeek
its strange that you wouldnt begin with husband i want to work towards a mortgage and to do that i need to have a better idea of our financial position  and that includes the business lets book some time to sit down and go over the financial situation together with the accountant,MLeek
the fact hes being vague is what needs to change deal with that reality dont tip toe around it and work behind his back thats isnt going to fix the problems here the finances are only half the equation,MLeek
youre in an abusive relationship,MLeek
hes escalating because your dependency is escalating he doesnt have to work so hard to mask his behaviours any more now that he has you trapped,MLeek
this will continue to escalate if you relocate hes not looking for a way out hes just stockpiling ammunition for the exactly the sort of combative and abusive relationship he wants to have with you,MLeek
deleting the texts was dishonest when you have an open phone policy thats a mistake she could have reasonably understood hed want to know she was in contact with this person and she choose to hide it she violated the spirit of the agreement even if not the the letter,MLeek
its not great what she did  if she was here id be telling her not to date someone she needs to manage like that  but his reactions is the real red flag here,MLeek
she doesnt have to be perfect for his reactions to be deeply concerning,MLeek
i actually agree with this 100 that is what everyone should want and need,MLeek
but you seem to refuse to realize how your behaviour is not communicating that or making much space for that,MLeek
your behaviour  if its anything like its been in this thread  is communicating that you need to be managed and pacified because you cannot control yourself very well,MLeek
we read what you wrote man were listening and discovering your girlfriend was right to be concerned you wouldnt respond reasonably to messages you dont like,MLeek
the only smart thing you did throughout this was take a huge step back when you realize you werent behaving yourself and you needed to go cool down i suggest you do that again because this isnt a problem with explaining to your girlfriend why youre mad that makes perfect sense we all understand why youre mad the place the miscommunication is happening here is your refusal to recognize that she made a reasonable choice to withhold information that you apparently cannot handle what she did was wrong but her judgement was correct about your ability to take the information in calmly it was the wrong choice but it was a totally logical one and you are refusing to acknowledge that which will stall transparent communication in the future,MLeek
the problem does not appear to be her understanding what she did wrong the problem is you realizing that she was totally rational to be fearful of having this conversation with you and you reassuring her and showing her that you can accept upsetting information without acting like an enraged toddler,MLeek
if you cant turn to her and say i understand why you made this mistake and i can promise you that while i may be mad at times in the future i will behave rationally and in a way that will not make you feel unsafe if you need to share information with me that i dont like as long as you can promise me to not repeat this mistake and lie to me to keep me from being angry,MLeek
edit again that is if you believe her if you believe her about what the texts were then also believe her when she said she assumed youd be mad  extremely and irrationally so if you need her to end contact with this person ask for that if you dont believe her break up,MLeek
yeah cannot imagine why a 20 year old might be fearful of giving him a message he dislikes s,MLeek
can you really not see that you are coming across here as totally unhinged and irrationally angry i wouldnt want to talk to you face to face when youre bringing this energy no one would,MLeek
if you suspect cheating break up if you dont grow up,MLeek
this makes perfect sense to anyone who isnt used to using their anger as a tactic to control others get a grip stop throwing a temper tantrum at randos online you asked for advice and the obvious advice is  even when youre right and shes wrong you cannot bring this kind of rage at her and expect transparent communication in the future thats not how people work,MLeek
i dont even know you and based on your words  here id be worried enough by your lack of empathy nd emotional regulation to not want too,MLeek
while she made a mistake i can see why she doesnt trust you to behave reasonably with this information,MLeek
youll never know what really happened here,MLeek
but if you believe her that it was nothing then you need to work on being someone its safe to communicate with as well she was wrong to do what she did but it was a tactic to manage your anger and anxiety for you and this experience will have only confirmed for her that you couldnt be trusted not to explode at her had she told you first,MLeek
while nothing you do will stop someone who really wants to lie to you or manipulate you remember that most of the time you have some ability to teach people how to treat you be careful about teaching her that you are irrationally angry and have to protected from bad news at all costs,MLeek
they grew up together the sister and the h were likely in the same grade sister saw him as a brother figure it wasnt unreasonable for her to assume her little sister saw in the same way she was just incorrect,MLeek
it wasnt ops problem before and its also not now,MLeek
op said there is no pattern of malicious behaviour from her sister there is just a perspective and it was good that op got a moment to address it,MLeek
not everything one person doesnt like or agree with is some sort of monstrous violation,MLeek
just let it go,MLeek
its her opinion its not an insane one she asked you answered,MLeek
shes not being cruel to either of you there isnt really a problem here it can be okay for someone to love you both and have those sorts of questions,MLeek
your plan requires a relationship being a housewife generally requires a breadwinning partner,MLeek
there isnt a problem here unless your family is not respectful of your relationship and how you and your partner choose to organize your lives,MLeek
youre 25 if you have a goal for your own life work towards it you dont need your parents to cosign on it or pat you on the head itd be nice but you need to learn to cope without it they are entitled to their own opinions and perspectives and you are entitled to ignore them,MLeek
if i didnt work so hard she would be very disappointed in the situation it would lead to,MLeek
i think youre projecting your own concerns about your role as a provider and you both are going to keep to accept things in your lives need to be compromised its not just her,MLeek
if you are hiding from her the real costs of your choices as a couple financially and emotionally then she isnt making her own choices and compromises with the full picture so yeah based on the limited information and understanding she has she might be disappointed but unless you think she is a fundamentally really selfish and ignorant human being then that is a matter of understanding one another better and being partners getting on the same team its not a matter of you failing her,MLeek
it might help you to consider this,MLeek
how would your wife survive if you were in a comma for six months does she have enough understanding of the financial situation to be able to keep things together would she know where to find the passwords or who to call if she had questions about the accounts because for both of your sakes she should if you have taken on so much of the burden of understanding and doing the providing role that she wouldnt be capable for six months then you havent set her up for success that is a failure for you both youre all in danger if that is the dynamic that exists right now,MLeek
acknowledge that yes you are prioritizing the game and no you dont want to go for drinks,MLeek
you want to stick to your plan and relax on your own it may involve playing a lot of star wars and it may not either way you like your plan and youre sticking to it,MLeek
sometimes the easiest way to deal with a fight is not to fight acknowledge shes correct you are prioritizing that game over going on a date she has accurately understood and that is okay,MLeek
he has told you plainly he doesnt care about your needs and will not even be discussing them with you as if you are an equal or a person that he values,MLeek
how you communicate isnt the problem here,MLeek
youre not his priority,MLeek
there are no magical phrases you can use to convince him hes decided already,MLeek
he has decided he doesnt have to listen to you,MLeek
anything you say will be labelled wrong or disrespectful or mean,MLeek
you will never ever win he has already decided youve lost everything he is saying now is just designed to keep you afraid and shut you up about it so you accept the situation he prefers,MLeek
wanting to see your partner weekly is reasonable he is not offering that kind of relationship,MLeek
thats the reality you need to stop thinking hes just independent hes an asshole,MLeek
this is probably the core of it,MLeek
he suspected he couldnt give her an inch without her demanding a mile when it came to any communication during this time,MLeek
instead of recognizing that as the huge red flag it really was he tried to enforce this maximalist boundary drawing to a head the fact they are not compatible and she is not someone really anyone should be dating,MLeek
op got to the right outcome but he could have probably wised up a bit sooner and gotten there by a smoother path if he just thought hey i should probably date someone who you can respect and understand when i can only have a very brief contact during this week,MLeek
i also dislike like hyperconnectivity i can go a day or with low or no contact with my so no problem and i dont want to date someone who couldnt,MLeek
however one or two texts during a week especially in the context of a young relationship is not hyperconnectivity it the basic maintenance of a human connection,MLeek
i agree that a healthy secure relationship should be able to manage a week of no contact,MLeek
however that wasnt what this was on either side she was absolutely not healthy or secure and ops inability to fire off a sentence or a damn emoji one or twice over seven days from the toilet also doesnt speak well of him he wasnt deployed or studying the ice in the arctic he made a choice not to give his new relationship 30 seconds of maintenance and consideration even once during this time my father travelled and trained like this all the time he usually called once for less than 15 mins and spent 10 minutes on some break sending a postcard the bar doesnt need to be that high,MLeek
and 20 years ago was only 2003 we all had email many of us had flip phones and we still had pay phones and post cards it was not that unusual to make brief contact with your closest people during holidays  which again this was not,MLeek
yeah we also had different standards for dental hygiene too the mind boggles,MLeek
if youve got legal protections you can seek you could report him,MLeek
but if you dont keep your head down and survive find someplace else to go and thrive where bigots are not given so much power over you,MLeek
break up are usually a healthy kind of selfish like i said a relationship shouldnt be a hostage situation if you want out then you should be out even if your reasons are irrational if you want to break up you still should,MLeek
its normal to feel bad we never enjoy hurting someone else,MLeek
a breakup isnt a negotiation youre not stuck with her just because she doesnt feel like moving back home,MLeek
and a relationship shouldnt just be a convenient social arrangement or a hostage situation,MLeek
break up are really hard and disruptive but if you dont want to be in the relationship anymore it is the hard work you need to do,MLeek
no one here can tell you for sure what it is you want but the reasons youve raised here for staying together itll suck at parties she doesnt want to move home are really shitty reasons to keep working at something you seriously do not want any longer,MLeek
all you need to learn from this is that school and workplace computers are for school work and professional work and that personal questions and research should be done on your own time,MLeek
you know there was plenty of bigotry and bias at play here we all know that we all know that gay men are people and they can fall in love and choose to be couples that isnt porn thats dating or romance or being human there is no reason to try and read other peoples minds and try to poll how many people online are gonna get offended stupid people exist bigoted people exist we cannot pretend they dont and its just beside the point the point is people are assholes and school computers need to be used for school work,MLeek
anytime you are on a device or network owned by your school or employer assume you are being watched by someone and that someone doesnt care about your intent and might be an asshole,MLeek
you need to speak to a therapist,MLeek
youre carrying a lot of resentment towards your wife but it boils down to a broken dynamic and your own struggles advocating for yourself a lot of this is about the expectations youre placing on yourself youre also clearly just burnt out on parenting you really are describing being a fully involved father  which is great but yeah thats like the time a baby takes the labour division might need to be changed up but that is the work,MLeek
