text,author
someone has sent me a video of you during a party and now im really concerned about your safety with the people you hang out with i need to ask you some questions so i can know youre safe now,MLeek
id say that id have to,MLeek
it seems very obvious to me that whoever sent you this video intended to shame your bf and bully him further the first thing you need to do is be clear it did not work your concern needs to be for his safety and your clear communication needs to be that nothing he does no matter how drunk he gets validates or excuses people treating him this way,MLeek
do not be the tool of his bullies be clear that his safety from abusers is your only concern if he says he is stays the fuck away from those people tell him youre glad and youre proud of him ask if he wants to talk about it any further dont demand the only answer you need is that he is currently safe from danger and abuse,MLeek
if its selfimposed then its not a ruleagreement with your partner its a personal choice you would make for yourself with any partner,MLeek
but to be entirely honest as a bisexual woman id still probably avoid getting too deeply involved even if you swore up and down it was entirely personal and your partner didnt even care because it just reflects that common attitude that sex between women isnt real sex,MLeek
youre entitled to a personal choice other people can have personal feelings about that choice,MLeek
consigned,MLeek
as a bisexual woman this implies to me that any sex and connection im having with the woman is lesser than purely on the basis of my gendergenitals,MLeek
a personal choice is fine and all  i have lived much of my adult life with only one penis but it was never a policy it was just who was in the mix at the time  and we cannot pretend these sorts of attitudes towards sex that doesnt involve a penis exist in a magic little bubble they exist in a context that id rather not operate in,MLeek
no the mother would likely need to be extremely illmalnourished to begin with in order to end a pregnancy this way with any reliability,MLeek
two weeks of deprivation would be totally insufficient for most reasonably healthy adult women,MLeek
young wolves become way more vocal yipping and growling in ways that dont appear to be very communicative when the rest of the pack is ostracizing them for poor social graces or bullying behaviours,MLeek
but human beings arent wolves either,MLeek
okay that explains the problem more clearly but you still need to stop trying to solve it for him,MLeek
tell him the actual problem for you hes shown you a plan but that plan is not happening you are paying for him but he is not being honest or accountable to you hes loosing your trust and your respect,MLeek
stop trying to tell him how to solve it and trying to fix it for him put it back on him hes damaging the relationship being dishonest with you and being dependant on you financially its not acceptable its going to end the relationship maybe not tomorrow but eventually you will be happier and healthier without him so you choose that any sane person would,MLeek
dont tell him exactly how to fix it remind him youve given him plenty of suggestions and you now expect him to fix this problem not continue to make it yours,MLeek
if that direct talk about consequences and boundaries does not get get him moving on this within a few days start planning to be rid of him if the problem is him and hes choosing to keep those problems and make them yours too then you have to solve your real problem by getting rid of him,MLeek
hes told you he doesnt want help hes shown you his plan you can disagree but if he had a plan and hes working it you need to stop pressuring him to make a better one its his plan,MLeek
and he may be right about what the limits of the charitycouncil powers are and its not your business in the least if he doesnt want to ask his parents for help,MLeek
if hes paying his obligations to the shared home then you need to let him carry his personal burden the way he chooses too and speak for yourself speaking for yourself can look like i dont have the bandwidth the listen to these complaintsstress right now or even i find it hurtful you continue to complain at me but will not entertain any of the suggestions ive given you at all speak for your own feelings stop trying to fix the situation for him its his,MLeek
if hes not paying his agreed on share of your shared home then you need to consider that this isnt a safe person for you to live with because he expects you to carry his burdens without having to listen to you or consider your feelings or perspectives at all,MLeek
this it makes me so mad when kids are taught this was the highest of high art and was inaccessible or highbrow rj literally opens with a bunch of teenage buddies making a rape joke a rape pun but so many teachers just swan on past that,MLeek
i was confused at first too then i remembered women are always bad and always to blame,MLeek
youre probably incompatible this isnt what you want,MLeek
you can and should bring up the idea of separate bedrooms but its concerning that he doesnt seem to recognize that option,MLeek
dude the part that made this really bad sex was the part where you made it her job to take care of your feelings afterwards no hook up wants to be your therapist or your coach,MLeek
the fact you are continuing to think it would appreciate to try and demand more of her time and attention is unhinged,MLeek
go watch some educational videos on performing oral sex and with the next woman ask her what she likes and make sure she orgasms before your penis gets involved,MLeek
leave this woman alone as she has clearly told you too,MLeek
you are not owed any amount of chances she is owed the basic respect of you not contacting her anymore,MLeek
dont be a creepy demanding child if you showed up at my house in this situation id call the cops and let them explain to you that i will not be speaking with your further,MLeek
nothing but me man me use big tool go vroom,MLeek
statistically women are safer drivers by every metric on a average women are just as capable as men of spacial reasoning but they dont overrate their skills by as much take fewer risks and can more accurately assess the risks women ding cars and crack fenders men kill people,MLeek
from a pure probability pov if you want to live let a woman drive,MLeek
if you dont want to be in an open relationship its time to leave this one because that is the best case scenario the best case scenario is that he wants a transparent and ethical open relationship from there it only get worse,MLeek
dont get stressed out just admit you want monogamy just monogamy nothing else if he doesnt agree fully and directly in language you can rely on let it be over,MLeek
your bf just put you in the be my pretty lady not a human being box,MLeek
it would be slightly different if he had simply said hed prefer you not fart around him when it was avoidable  and because we are human he knows it is not perfectly avoidable  as just a personal preference the fact he connected it to being ladylike is gross and demeaning and very very stupid,MLeek
its funny they think rich men werent hoarding women before,MLeek
you know its just that less of you plebeians die young right most of you were not gonna be landed gentry you were not going to be assigned a buxom teenager you were not likely to be master or meritorious in 1020 or 1620 or 1820 either,MLeek
youre just angry you dont have a woman an assigned woman you can punch down at no matter how low you are,MLeek
i always wonder if they think small children in guatemala are just failing to manifest food and clean drinking water like if systemic issues dont exist then there are entire nations causing famine with all their negative self talk,MLeek
fit of rage is a phrase which should only ever be associated with an ex,MLeek
you dont have to be perfect to deserve not to be absurd that is a lie abusers love to tell to keep you trapped,MLeek
thank you for explaining why this might be a deterrent it seemed like a very easy hoop to jump through to me for someone with malicious intent who wanted to create a false sense of security,MLeek
i am opposed to engaging with people who exhibit a behaviour i have found to be directly connected with negatively resentment and even other controlling behaviours,MLeek
also i am woman who largely but not exclusively dates men,MLeek
in my experience men who start off with this demand quickly have other demands and accusations,MLeek
i have strategies to keep myself safe this is not one of them,MLeek
exactly the opposite i guess my strategy is too avoid men who exhibit a behaviour that doesnt make me feel safe and respected,MLeek
your husband turned you into his private porn star without telling you about it he felt entitled to doing so without your formal consent and is now demanding a formal request they be deleted,MLeek
i doubt your husband is a compete fucking moron he was aware or should have reasonably assumed that you believed the videos were deleted and that is what you wanted he should not have felt entitled to them in this way and trying to make you the bad guy who demands he give up something he never should have taken without explicit permission is revolting,MLeek
you are underreacting,MLeek
it feels like an invasion because it was,MLeek
tell him to delete them,MLeek
tell him he fucked up royally by behaving entitled to these videos without a transparent conversation at very least you should express deep disappointment with his judgment,MLeek
hes 32,MLeek
hes not confused about pets he doesnt need it explained to him this is who he wants to be the asshole who treats your dog poorly and enjoys its fear,MLeek
he sees you only as a servant to his future baby not as a person balancing her loves and needs,MLeek
and people who are jealous of pet are often jealous of babies as well,MLeek
dont keep such an open mind your brain falls right out this is exactly what it looks like,MLeek
if trust is broken dont date her,MLeek
testing her is just demeaning yourself in a shitty relationship that already isnt working,MLeek
you were manipulative you were toxic you decided to stay in a relationship you shouldnt have and used that as excuse to practice being a bad person,MLeek
i dont understand how this strategy is protecting someone from a trafficker the trafficker is usually real local people arent they it doesnt seem like it would have helped the victim in that article,MLeek
youre mistaking consequences for cant do it,MLeek
you absolutely can break a contract and if it was a legal one there might be consequences for doing so,MLeek
but scientology cannot enforce their a billionyear contract in court and you cannot use the law to force your partner back into the marital home or bed if they dont want to be there,MLeek
yeah im fine with that youd be unmatched not an issue for me what reason a person concocts at that point,MLeek
yeah ask for a facetime first and okay but ask me to buy todays newspaper or make some weird hand signs often within the first day of matching just gtfo,MLeek
i used to do it without fail these people were all bitter resentful and a bit controlling,MLeek
he knows how you feel he doesnt care he feels entitled to placing this pressure on you he thinks you should preform this way for him,MLeek
youre incompatible,MLeek
and hes a bully,MLeek
dont stay with him,MLeek
but since youre going to anyways say this comments about my femininity skirts and makeup need to stop youve cross the line from expressing a preference to being really hurtful if you care about not hurting me you will stop if you care more about what i wear then how i feel we will break up maybe not tomorrow maybe not right away but itll happen if you dont stop hurting me,MLeek
this it has to be really extreme before i assume they were actively trying to be deceptive im bad at reading photos,MLeek
im far more annoyed by men who lie outrageously about their height ive happily dated men who are shorter than me and secure about it dont want to date a person who isnt comfortable in the height difference,MLeek
i dont know if youre joking but when someone does this to me i immediately unmatch my photos are current and authentic and i use to comply but i have never had a positive interaction when i did,MLeek
a person who comes at me from this kind of place of bitterness and control is not someone i will continue to speak with,MLeek
dating is risky and often disappointing but if all youre bringing into is distrust and anger i want none of it,MLeek
then be honest with your own needs and walk away,MLeek
i didnt mean to imply he needs to regret or feel ashamed only that people who have enjoyed casual sex in the past are still capable of choosing monogamy and being faithful in my experience they are often better at it because of the lack of fomo,MLeek
youre not compatible,MLeek
he could be just as capable of commitment and monogamy as any man who ever lived but it doesnt matter if you cannot believe that,MLeek
if youve lost trust this is over,MLeek
you should date the person in front of you not their every past choice or the person youd hope they could become you need to be able to believe what they say about their current choices and values if you cannot be happy with that person today be honest and bow out,MLeek
because freedom,MLeek
the republicans are right and royally fucked,MLeek
they have cultivated a delusional base that is not capable of selecting a candidate who can win a general,MLeek
running to trumps right is the smart way to get the nom and then to in loose the popular vote again and probably the election,MLeek
you just know this man watches nothing but hard core anal porn and pimple popping videos and is in deep denial about his desire to be pegged,MLeek
because its not about attraction,MLeek
like rape the power is the point the violation is what they want,MLeek
they are just exerting power in a public place all public spaces belong to men in this persons mind women just walk through them women in mens spaces get what they deserve,MLeek
ive a had few men try to genuinely compliment me you can tell the difference and no its not that they are chads they have said shit like cool hat awesome vibe or wish i was going to whatever party youre headed too,MLeek
its really not that hard to compliment a stranger stand still do not move into their space compliment a choice not a innate thing about their body allow the interaction to end right then easy,MLeek
i disagree with your premise,MLeek
the divorce rate doesnt speak to people who want to end it over the smallest thing most people i know who divorced worked damn hard sincerely to avoid it the people i know whove been married 10 years went through periods where they had to do that work too,MLeek
assuming every divorce is a personal failure is a lingering stigma not a reality,MLeek
and how can we say the divorce rate is high when were comparing it to a time when it was practically financially and often legally impossible to divorce not to mention the stigma do we really think marriages were twice as healthy and happy in 1950 as they were in 1990 or that they were 3x more blissful that people were really freely consenting to stay married more often even if your own family history was happy enough most of us can ask our grandmothers about the women she knew and be quickly disabused of that notion,MLeek
and why in earth do you think people who dont want to marry not marrying is a problem,MLeek
of course he did,MLeek
my ex and his family were appalled that months after he dumped me with a bit of bonus cruelty i did not come to care for him during his unexpected surgery as i had during the first eight of them you see he had thought he was healthy now so he no longer needed me he had blamed me for stalling his life but once he was in need again i was a monster for not actually putting my life on pause again to care for him,MLeek
the mind boggles,MLeek
in other words people who are less likely to want commitment and compromise at that stage of their lives are less likely to work towards commitment and compromise at that stage of their lives,MLeek
and im disagreeing it seems very obvious to me that is not many people that is a minority the majority are inclined to stay longer than they really should and keep working,MLeek
more importantly its the right outcome thats the would i want to live in if someone has one foot out the door give em a shove problem solved,MLeek
hah id say they dont actually understand consent,MLeek
they just glom on to buzzwords to try and make their positions sound modern and palatable its like when they talk about the loneliness epidemic and mens mental health stigma and youre nodding along because yes real issues but then you realize they are actually suggesting the government gift these men sex slaves to solve  the problem,MLeek
i agree the only reasons i can see to get married today is if you believe its a religious sacrament terrifying to me but ok or if being married provides better protection for the children and their rights where you live otherwise dont get it very expensive party and pointless peice of paper for me,MLeek
i cannot comprehend this attitude towards people its so objectively and observably false,MLeek
most people the vast majority keep working at preserving a relationship for months or years after it becomes objectively clear it should probably end and both parties would be happier and healthier we all know these people we have mostly been these people,MLeek
i looked back in my life and know where i should have had a zero tolerance policy lying about money throwing things in anger being mean to waiters,MLeek
healthier conflict resolution skills often contribute to relationships coming to an end because healthy approaches to adversity and conflict include fundamentally changing the terms of the relationship agreement or even ending it,MLeek
i work very hard to look like im ignoring everyone who is hollering for my attention in public i always listen very closely for a few seconds before deciding if im going to engage and usually i will not if youre asking for directions or warning about construction sure if its unclear in those few seconds what youre up too i assume its no good and keep walking,MLeek
thats nice,MLeek
legally speaking if there is going to be marriage there must be divorce without any outside authority judging whether or not the reasons are good enough anything else in unjust to everyone,MLeek
no fault is a term of art for the kind of separation youre talking about  where no one but one or both of the two people in the marriage gets to decide its over the term exists because there was a and time and place recently and currently where they wasis not the case it doesnt mean everyone is a blameless little angel,MLeek
hes certainly expressed the willingness to blame the woman when he rapes her if he sees the opportunity,MLeek
this seems to be connected to new movement in the manosphere against no fault divorce she consented to be mine and she is not entitled to withdraw that consent for any reason which means its not actually consent at all so the law is wrong when it gives her the ability to leave the marriage,MLeek
the problem with the divorce rate in their minds is the same problem as the false accusation rape hysteria they dont want women to be able to withdraw anything they interpreted as consent to their supremacy they want to trap one and not have to worry again about being worthy or of a partnership,MLeek
this guy knows with 100 certainty that no woman has ever enjoyed herself with him and never will,MLeek
motherhood is the best thing when it serves them personally or their political goals,MLeek
the like motherhood as an ideal not as an occupation that might not directly benefit them,MLeek
the fact that an actual person they have to interact with may be doing the work of being a parent while female is inherently distasteful,MLeek
i think it should be a goal daily on a personal level  ignore them live your life,MLeek
but beyond the personal sphere we cannot afford to ignore them not only do the extreme members try to kill us with guns and with legislation but the shepherds are leading more and more young men to the slaughter on a societal and political level they cannot be ignored they want women subjugated and their strategy relies are making more and more men desperate entitled ill or angry enough to support that cause  on the false promise that access to an unhappy subjugated women will make them happy and that they will all of course be found deserving and meritorious by the new patriarchy,MLeek
its a bad habit and she needs to stop,MLeek
could it mean shes not over him sure but a bit more likely is that shes picking at the scab rerunning conversations in her head and basically letting this wound fester,MLeek
she cant build a new healthy relationship unless she recognizes this behaviour is selfdestructive just cause lots of people do it especially just every once in a while and not weekly doesnt mean it okay,MLeek
in the end id be more concerned that its been two years and they havent formalized the divorce,MLeek
you need to go see what you can swing with work,MLeek
look that kind of response is unkind its not crazy for your partner to ask you to commit to spending some vacation time with them or to ask you to confirm those plans in june for july you may not mean to be jerking her around or telling her shes not a priority or embarrassing her in front of her friends but the result of that kind of response can rationally be all those things,MLeek
if you cannot take vacation then figure out when you can and calendarize it now,MLeek
youre working too much regardless of what else is going on here in this relationship your work life balance sounds like complete shit right now and a reasonable partner will become frustrated by that,MLeek
ask him what his plan is for his agreed on portion of the bills are if he is out of working for a month or 3 months or more,MLeek
thats the question you need to ask him and make it clear you have not agreed to covering all the finances for an indeterminate length of time he needs a plan to meet his obligations he needs to communicate that plan to you,MLeek
stop trying to fix the job search issue for him start expecting him to address your very reasonable fears and boundaries like a reasonable person,MLeek
its not your job to find him a job,MLeek
its his his to explain to you how he is going to meet his responsibilities once this contract ends its not totally crazy to be looking forward to job searching after his contact ends but if that is his plan he needs to tell you he has enough cushion to make it happen you are not his safety net you just moved in together that is not a kind or reasonable expectation of you,MLeek
i didnt want a better life for the women,MLeek
just tell him the truth its not working for you,MLeek
this daily texting is awkward and confusing you dont want to continue it you cant build a serious connection like this its hard to even build a friendship tell him you want to stop wish him well,MLeek
block him when he doesnt reply with grace,MLeek
its not fair,MLeek
its obviously abusive behaviour,MLeek
youre not in an ethically nonmonogamous relationships youre in an emotionally abusive one,MLeek
i honestly dont know how women have sex with men in some states these days at all i love sex but it seems unnecessarily risky,MLeek
but at least now you know he wasnt getting better he just has a little while where he had fewer reasons to be utter shit now he has a new  reason to be a selfish abusive peace of shit and hes going all in on it,MLeek
you dont need a perfect excuse but his transparent attempts to bully manipulate and shame you into silencing your own feelings and needs are pretty damn perfect as valid reasons to dump a person goes,MLeek
hes gonna call you selfish and stubborn if you were paying his rent and donating a kidney he just wants to get his way it has nothing to do with reality,MLeek
one of my few boundaries in my open relationship is that neither of us sleep with who is not prochoice even though protection is always used as well,MLeek
i may stay in the relationship with someone else being pregnant but i wouldnt try to force a polycule or triad because she got pregnant the two of them may have a relationship as coparents and that would remain separate from my relationship as partner or friend with either of them,MLeek
but you really shouldnt stay in this relationship,MLeek
he is manipulative and emotionally abusive and if he actually uttered the words small inconvenience to refer to his own child i might take a baseball bat to his bits before i go,MLeek
there is nothing here but to live and learn,MLeek
people are more than just toys or experiences they are people first and foremost dont think because youre less experience its okay to treat someone who isnt openly transparently consenting like a toy or a fun ride its still really important to talk about what you want dont make assumptions about what they want or feel,MLeek
even if you had watched the movie he may still have ended up connecting with and choosing someone else so dont follow that road in your head to silly places,MLeek
its totally normal and healthy to have fantasies but stop fixating on this guy,MLeek
just keep dating,MLeek
use your experience to inform your future choices,MLeek
this is just not a person to engage with the rest is unknowable you can know you were right to get away from her,MLeek
there is nothing to learn here except that you were right eventually good for you,MLeek
