text,author
youre arguing that you see the exact same percentage of women imagining the man in the service role is seriously flirting with them sure we cannot read minds we can read context like the context of someone being paid to be a pleasant sales associate or server,MLeek
because i spend a lot of time with women and while i have definitely heard a sales guy or bartender referred to as sucha flirt not a single woman i have met was confused about his role as a service provider,MLeek
there are plenty of errors that are just human but this one when it comes to flirting vs service is just not a 5050 cognitive error,MLeek
he told me that even watching porn when you have a boyfriend should be considered cheating so naturally i would assume that the same should apply to him,MLeek
if none of the other reasons cut it for you this one obviously should he shamed you and verbally abused you for far far less than he deliberately did behind your back and then he lied about it in the lamest possible way he thinks youre a moron,MLeek
whether or not you or i or he thinks this is cheating doesnt even matter it doesnt have to be cheating to be totally unacceptable dont get pulled into that argument with anyone this is all a very dangerous double standard from a man who is giving every signal he is willing to abuse you,MLeek
you dont owe him a conversation this isnt a debate this is him getting dumped for being dishonest and a dangerous partner keep yourself safe end it quickly and cleanly get rid of this man,MLeek
you are not completely innocent here because you violated the agreement when ella said she had caught feelings your responsibility was to say i understand but since that has happened i am no longer comfortable continuing with the sexual relationship,MLeek
youre not a monster but dont get attached is a hope its an intention its not a thing that can be promised it is not a boundary the boundary is if one of us catches feels we stop fucking,MLeek
so you had the exact same responsibility as ella had to end it when that happened  i would actually say you had the greater responsibility at that point since she had just told you that her motivations and judgements were clouded by her emotions and her attachment to you continuing to have sex with her at that point was selfish and naive your actions were not reflecting the agreement you said you wanted when you continued to meet up and have sex with ella after that conversation,MLeek
youre not a villain but you did fuck it up you had a clear line with ella at which all sexual connection should have ended and you both blew right past that line maybe not everything ella thinks of you now is reasonable but it was not kind you should have done better,MLeek
you need to just walk away,MLeek
he may be a lovely partner in some ways but he is absolutely not capable of offering you a relationship you should feel at all secure in and hes been dishonest from the beginning trying to manipulate you into accepting something he knew was a rather lousy offer,MLeek
this isnt a situation where everything is great except this this is him this is a guy who dove into dating while still fullon living with his ex gave totally false timelines introduced his kids way too early and has not been prioritizing his separation or creating a healthy home life for his kids,MLeek
this may be a good guy making shit choices but more likely its a rather shitty guy making rather shitty choices,MLeek
breaks are bullshit they are slowmotion breakups that just prolong the drama its time to be broken up tell him hes welcome to call you if he gets his act together and starts to actually live separately from his ex and has the time to date and be a coparent but dont hold your breath far more likely hell move on to another young thing he can manipulate into accepting this shitty situation for a few months,MLeek
its a neutral term  if you value your friends as friends what was their argument for misogyny that men didnt actually want her friendship so calling them that was offensive or a mislabel,MLeek
i think there can be a lot toxicity in fwbs situations because people forget to be friendly and end up viewing the other more like an amateur sex worker instead of buddy you share a fun activity with or they define down what would be objectively called casually dating into a fwbs situation but in my experience those issues are also pretty gender neutral men and woman both those mistakes,MLeek
hed never be so beta as to allow something like over a decade of data and welldocumented trends to penetrate his skull not when he saw with his own two eyes how the paid server smiled demurely at him not merely performing  her job in the expected style but clearly begging for the leadership and protection of a man,MLeek
there are cultural norms there are affects,MLeek
there is no more truth in his racist delusions about what those norms actually represent in individual human relationships then there is truth is his understanding of human biology,MLeek
ironically he did figure out anal tho,MLeek
and with a healthy dose of idiots not being able to tell the difference between customer service and women being super into them,MLeek
warningprawit appears that you are using praw in an asynchronous environment,MLeek
it is strongly recommended to use async praw,MLeek
see  for more info,MLeek
this guy is telling you stories stories about how he think its permissible to treat others believe him,MLeek
he will turn around one of these days and declare you are just like all the others  and he will decide probably without telling you that he can treat you like the others then he will tell you youre not entitled to be hurt or angry with him because he warned you,MLeek
lots of people score a bit higher in sociopathic tendencies and recognize that means they need to work a little bit harder to empathize or to keep the ego in check people who struggle with this are pretty safe they compensate and focus on what healthy relationships really take people who say well this is just how i am and now you know fair warning are not,MLeek
you dont compromise,MLeek
you trust him so trust him to select his own friends and not hook up with strangers,MLeek
if you think he can be persuaded to cheat then you dont trust him and shouldnt date him  hes a 20 year old adult not an 8 eight year old on the playground being bullied into eating dirt or some shit if he doesnt want to cheat he wont,MLeek
emasculated is one of those toxic traps where the more you help him the more blame youll catch,MLeek
continue to be realistic most entry level jobs are easier to get when youre physically present there is little reason for someone to want to employ an 18 year old who cant start tomorrow thats usually the appeal of teenage employees,MLeek
besides that just listen agree that it does suck and it is disappointing  because it is that what it is not is a reflection on him as a man reminder him this has nothing to do with his gender  and even less to do with yours hes a person not a potential provider,MLeek
she didnt want to talk to a group of people who had said nasty things about her,MLeek
this is not rocket science youre being a weirdo who is making it all about sex when its about not talking to mean people who have insulted or shamed you previously if she has an ex who is a basically decent person or perfectly reasonable to not be nervous about him but to be nervous and want to avoid a group of bullies,MLeek
what went down with her made sense your reaction was intense and really strange you need to figure out what was going on inside your own head that led to this her explanations for what went on in her head pass the sniff test just fine,MLeek
its honestly terrifying where americans even ones who might consider themselves democrats think the centre is,MLeek
i remember back in the day trying to explain to a few american friends that obamas policies were not left of centre in any other established democracy very centrist even sometimes right of centre which was a large part of his global popularity,MLeek
but the far right nutters just saw a black man lost their shit completely and now here we all are,MLeek
shes not your problem its not her job to fix the issues in your relationship shes not your ally and youre not trying to help her out youre desperately trying to manipulate her into helping you out because you and your bf cannot find an agreement that works,MLeek
your problem is that you are choosing to stay in a relationship with someone you believe is cheating on you,MLeek
stop pretending to be worried about her wellbeing get a damn clue and realize youre the poor girl involved in this situation who isnt behaving in healthy ways or with any selfrespect,MLeek
if you cannot resolved this by speaking with him then it cannot be resolved,MLeek
stick to the no,MLeek
this was a rather transparent move on her part to force a meet with the children to justify her curiosity about you,MLeek
you and your bf have not decided to make a relationship with the children part of this relationship yet continue to not include the children in your plans when you do decide you are both ready for that step then you and she may need to meet briefly while custody is exchanged that is sufficient she gets to shake your hand not break bread with you,MLeek
whats best for the children is you declining as much as possible to play her game or become more a character in her little drama,MLeek
hes 22 he is not a boy he doesnt need to be handled hes not a toddler going through a phase where he find poop hilarious,MLeek
it is completely realistic to expect a 22 year old to be honest about their own interest in and opinions on porn use while in a relationship and to keep a promise if they make it,MLeek
men are people not dumb animals who cannot help themselves,MLeek
he doesnt agree with you about porn he never has he thinks its acceptable in a relationship,MLeek
if you want a relationship with someone who doesnt watch porn you need to date someone else,MLeek
if you want to stay with him youre going to have to find a way to deal with this as a legitimate and transparent disagreement instead of a hard boundary,MLeek
this man is too old to not understand that not everyone has a close or meaningful relationships with their parents and adult siblings,MLeek
and five months is quick for this kind of pressure and judgment,MLeek
what is weird is that he is not making the effort to listen to you and i understand who is actually important in your life,MLeek
as sad as it is if she needs to break up over this youd be wise to just accept that and wish her well,MLeek
she withheld information that was clearly relevant to her about her virginity and sexual experience for five years,MLeek
youre not the asshole she needs do the work herself to move past this if she is not willing or able to do that then you need to have the strength to face the end,MLeek
i wouldnt date this man,MLeek
hes telling stories about money mean untrue stories about you because of his choices about his money,MLeek
its one thing to be bad at budgeting but telling mean stories that its someone elses fault that youre spending what youre spending is a serious character flaw and one that will likely impact other areas of his life too itll be your fault he doesnt have enough free time your fault hes gaining weight your fault the house is cluttered with things your fault the grocery bill is too high,MLeek
be very very wary of signing up for a lifetime with someone who externalizes blame like this his gfwife will always be the most conveniently located external person to take the blame for his actions,MLeek
romantic intimacy not requiring a big budget is not your real core problem here,MLeek
this is shady and i wouldnt like it,MLeek
but his answer is plausible and im not surprised he tried to manage you this way,MLeek
this whole exchange was deeply immature on both sides,MLeek
talk to her as everyone is saying try some more actually relaxing games,MLeek
lots of gamers  men and women  think the golden rules change when they are gaming and that angry outbursts and namecalling are part of the culture you need to be able to say clearly that its not i love to game but ive had to have a few tough conversations with friends that if being able to yell or call people nasty names or throw things in anger is an important part of thier gaming experience  then they dont to game with me,MLeek
im an adult who likes to game if you are a gamer because you want to behave like a toddler sometimes please play with the other oversized toddlers,MLeek
it sounds like he feels he has done nothing wrong and broken no agreements with you,MLeek
he deleted the texts for six months,MLeek
he knew damn well he was violating the spirit of his exclusive relationship agreement with op even if he tries to claim he wasnt technically doing anything wrong trust doesnt work on technicalities trust was broken here,MLeek
why do you need to be the bigger person,MLeek
youre not holding on to the past youre addressing an ongoing issue with his choices,MLeek
he continues to bask in the attention of this woman who behaved inappropriately for months and who he only stopped enjoying the attention from when he got caught he knew he violating boundaries with these conversations  you know he knew because he was deleting the messages and telling her they were a problem but not telling her to stop it,MLeek
if a person who has a long history of ignoring my boundaries and flirting with me in direct disrespect of the relationship they know damn well im in climbs onto the treadmill beside mine i wrap up my workout and leave that person is not my friend,MLeek
it is reasonable to assume from this conversation hes at least quite aware of it and has seen some,MLeek
what you need to ask is if he engages with it regularly and thinks its acceptable porn consumption because you dont think its acceptable and you dont want to date someone who ever engages with it,MLeek
good luck with it  and with the therapy,MLeek
i think your boundaries are the right ones but your fears are a bit extreme and they are making this harder for your to deal with than it needs to be youre getting overworked and spun out and drawn to extreme cases you need to reign that in and realize your boundaries are important and valid even if watching this porn doesnt necessarily mean your bf is ever going to even look at an actual human child in that way once in his life its still not okay you dont have to be okay with it,MLeek
if you watch porn that features childrens bodies  even if they are illustrated  i cannot date you i feel too strongly that that is completely wrong to do i expect you to answer honestly is this porn you engage with and think is acceptable,MLeek
first you get into therapy you work on better managing your anxiety the odds of there being immediate risk or danger to anyone on this topic are rather low,MLeek
ethics in porn creation and consumption is important to me as well i would also draw the line with my partners if they were engaging with illustrated porn of prepubescent bodies its not acceptable to me even as fantasy even as an illustration to contextualize a childs body as a sexual object its a hard red line for me i wont date that person,MLeek
but like your cnc kink i would not assume that porn consumption meant pedophilic criminal behaviour was terribly likely just that i dont want to date someone who doesnt hold themselves to a higher standard when it comes to consuming pornography and framing their own sexual identity through what they consume,MLeek
youre going to need to revisit this conversation with him but i think you need some tactics to deal with anxiety before youre going to make it a productive one,MLeek
if hes testing you hes validationseeking and validation seeking is knowing how to communicate to get what you want its just a toxic way to go about it,MLeek
in the end you have to decide what you want in a relationship but if i was feeling i was having arguments multiple times a week after only two months i wouldnt be keen to continue either you need to be able to reframe these conversations and bring the temperature down or youre in for a hell of a lot of needless drama in my opinion,MLeek
if hes seeking attention and validation by picking petty fights with you thats pretty much the worst possible dynamic for someone who has a history of feeling smothered in relationships even if the other fights get resolved easily enough that would be a real concern to me i dont keep people around who use negative behaviours to try to get my attention,MLeek
if youre now in ldr after the move i absolutely wouldnt hold out much hope for it getting better,MLeek
this is two months this is you both on your best behaviour its not great,MLeek
i often joke that no one who lives in toronto drives in toronto we drive only to get out of toronto,MLeek
i owed a car for years and walked 45 mins to work on most days could i have driven it to it 10 mins on most days absolutely would it have been worth it absolutely not,MLeek
hah it really isnt but i do think were under a lot more construction downtown than ottawa is thats a lot of the dust in the downtown i have that experience every time i visit new york and the new yorkers are all like how do you like the big city and i think i know for a fact you can keep cities olders and wetter than this one cleaner than this one but its great,MLeek
youre unlikely to acquire the gf object to service your emotional needs like its a rare drop or legendary weapon or a partyplanner or a substitute mommy,MLeek
the older you get the more women are going to be turned off by this attitude towards them likewise your inability to form friendships with women you dont find sexually appealing always a bit of concern it means you are not able to value a woman as a person unless there is a chance they will be servicing your gf object requirements,MLeek
youve had a relatively normal amount of dating experience for an 18 year old thats not the problem the attitude is,MLeek
you need to fill your life better with or without a gf this dissatisfaction and any childhood drama is your job to address not the gf objects job build a life another person would actually want to share and be interested in and build relationships that arent based solely on getting your needs met but on equal exchange and mutual enjoyment,MLeek
play stupid games win stupid prizes,MLeek
some things are only fun as fantasies its okay to learn that,MLeek
also stop thinking about these potential thirds as if they arent real people with their own agency just because shes in an open relationship doesnt mean she had wanted to fuck the two of you,MLeek
keep the conversation shelved full stop it doesnt need to be more complicated than that just because someone seems convenient doesnt mean you should fuck them,MLeek
you put your foot down,MLeek
and if youre ready for a divorce go ahead with that and get a lawyer involved,MLeek
this is now crossed the line from him feeling whatever hes feeling to him acting in a way that is emotionally abusive,MLeek
the constant accusations of cheating without him willing to do anything to address his negative thoughts or behaviours or bad feelings is unacceptable it is abuse he needs to take some damn responsibility for himself and stop adding this issue entirely to your workload youre already doing plenty if he actually wants his feelings and concerns addressed he has to be part of the work to resolve this and not the abuser,MLeek
you cannot prove a negative you are know youre not cheating you know you dont the time in the day to cheat you cannot fix this for him you can recommend couples counselling but go in very cautiously because there is a real risk here that he wants to abuse you  that that is the point and not the accidental outcome here,MLeek
dont consent to cameras or to the invasion of your privacy until hes 100 committed to doing the work to get past his own bullshit if you do he will very very likely use this access to escalate his abuse not resolve it you seriously need to be considering your safety first and his feelings second,MLeek
the sad reality is very few 40 years old are choosing partners in their early 20s because they want an emotionally healthy relationship built on mutual respect possible but not likely,MLeek
and the stereotype is also sadly true he probably knows you dont have 10 mins in the day to cheat the most likely thing here is that he is projecting and is either cheating himself or wishing he was,MLeek
most relationships dont last forever,MLeek
but you dont stand a chance of noticing a good relationship when youve got one if you dont change these bad habits,MLeek
take a deep breath and see this for what it is this relationship isnt perfect this relationship might not last however if you want to give it the best shot to last or even to end on good terms you need to change your habits and find ways to manage your anxiety that should be the bulk of the work youre doing to maintain this,MLeek
thats nice,MLeek
hes naive dont take on his education,MLeek
consider this a learning experience you need to laugh at what you cannot and should not do anything about youre taking this too onto yourself,MLeek
sure,MLeek
but cities that dont prioritize walkability bike lanes and green spaces dont see those same benefits and then there is the increased risk of cardiovascular and respiratory diseases from dense urban living which increases the risk of stroke heart disease lung cancer and asthma,MLeek
there is a lot of evidence that living in cities  especially welldesigned and governed ones  is a net win for individual human health but there is no reason to pretend there we are not making some trades offs and that really we need to make larger changes so people are able to be healthier regardless of the community they are living in,MLeek
you absolutely can tell her i wouldnt id go and enjoy her company  consider it a gift youre giving her  and id tell her later in a few days that im played out on tea and want to make a different tradition offer one or two other suggestions for a new event or activity you can do together on special days,MLeek
its not untrue its just framing the message in the least hurtful way sending her scrambling the day before is not terribly kind,MLeek
this is the answer dense urban environments dont have many health benefits but this is the one they do generally less time spent commuting and commuteserrands where walking is economical,MLeek
toronto is also exceptionally diverse  even in comparison to other major cities on the planet  so youre looking at a totally cornucopia of different eating habits and cultures around food,MLeek
if you drove out north to the small towns in ontario youd see a difference although broadly speaking canadians are slightly less obese than american counterparts probably a lot of reasons some just around portions sure but also i expect that better access to preventive medical care means we may get the heads up earlier if were at risk,MLeek
that doesnt change your responsbilty to this relationship,MLeek
your responsibility is to end it,MLeek
its not reasonable or kind to sit back and say well he hasnt left me yet so its his own damn fault hes still dating an addict its not all his fault you fully share the blame when you allow a relationship to continue where you know for a fact you are not offering them what they say they need,MLeek
youve already made it clear youre not going to accept this ultimatum,MLeek
which means you must end the relationship nothing else is acceptable,MLeek
yes the relationship should end if you dont want to abandon your lifestyle of using,MLeek
its really not any more complicated than that youre not dedicated to your sobriety he wants a sober partner its time for one of you to end this,MLeek
its not all on him its your job too dont encourage him to leave walk away because you are not offering him what he has told you he needs this is on you stop trying to make it all his job to leave you he should but youre just as responsible for the end as he is,MLeek
extremely skewed this is a relationship your wife has formed its not a mechanic for humans,MLeek
im concerned you continue to gloss over the fact you are eavesdropping that needs to stop completely and forever the only information you are privy to about her therapy is the information she shares with you,MLeek
youre missing mine,MLeek
there is no situation in which is acceptable for you to sit and listen to your wifes therapy like this without both her permission and the therapists,MLeek
you describing hearing way to much and forming far too deep an opinion for it to be accidental and even if you insist this was accident you dont appear to realize it cannot happen again,MLeek
we dont know the therapist sucks right now neither do you we do know you are not holding yourself to an appropriate standard when it comes to your wifes privacy because you have told us you are not,MLeek
this is staggeringly inappropriate and disrespectful why do think this is an okay way for you to behave do you sit beside her at every dental cleaning to hear what the dentist says read all of her emails examine her shit before shes allowed to flush,MLeek
you need to quit this,MLeek
you do not know what is going on with your wife but i dont know what is going on with you but you have some of your own shit to figure out here this is not cool,MLeek
hit the breaks hard and put these assumptions aside,MLeek
and absolutely stop eavesdropping leave the house if you cant help but overhear shit that shouldnt even need to be said,MLeek
you dont know what goes on in that room your envisioning is counterproductive and unhelpful,MLeek
it is extremely unlikely the therapist drastically changed their approach unless your wife askedindicated they do so,MLeek
