text,author
stop trying to be his therapist and tell him to get his damn ass to an actual one if hes experiencing intense feelings he cannot speak with you honestly about,MLeek
youre incompatible,MLeek
and she basically said she feels she needs too and is entitled too financially punish you in order to stop you from becoming lazy why does she want to marry you if she thinks that you need to be threatened with higher costs in order to perform and set goals yuck,MLeek
but honestly the even bigger longterm issue here is disagreements about parenting like the importance of private schooling if the rest of this doesnt scare you that should terrify you that disagreement is going to harm the children,MLeek
shes told you she is going to be constantly chasing status and making comparisons between your family you and everyone elses family if dont share that keeping up with the jones mentality and want to spend big to keep up public appearances then youre signing up for misery,MLeek
also shes way too old to be this much of a brat,MLeek
dont do this,MLeek
use the letter to sort out your thoughts but then if you really need to express these thoughts to him and have decided to take the risk do it facetoface,MLeek
whatever the outcome youll feel far far more confident and at peace with it if you do it face to face i promise its scarry to do things the right way to get a clear answer but thats the better path and believe it or not if youre gonna get rejected itll hurt less that way,MLeek
if you cannot face this risk in person then you shouldnt be taking the risk at all,MLeek
hes not a faithful man he never has been,MLeek
can you be secure and healthy with someone you cannot reasonably expect to be faithful to you,MLeek
you are being naive these are not challenges this is him making choices major changes in character and in core choices are rare and they have to be internally motivated unless he has explained clearly why he has changed his choices moving forward for himself and the life he wants for himself and not just to appease you there is no reason to believe he will not choose what he feels perfectly entitled to choose which is to engage with sex workers and lie to you about it,MLeek
youre 23 you got a hell of a lot more life left i wouldnt recommend wasting any more of it on this one,MLeek
nothing about that ran out as rhetorical to me if it was an attempt to persuade op of anything else except that you believed her to be held culpable for being emotionally abused and manipulated for years it was not well stated,MLeek
yet here you are claimed it was a joke to brush it off as if not trying to get him mad at you for lying to you thats pretty wild and makes no sense,MLeek
it makes perfect sense for someone in an eightyear partnership who is used to being silenced lied to and made deliberately distressed you stop responding reasonably to the manipulation and abuse because reasonable responses to it never stopped the behaviour in the past you get confused direct communication feels impossible that is the goal of this kind of abuse to make it feel impossible and pointless to respond in the reasonable ways  with legitimate anger or clear boundaries  that you assume op should it doesnt happen overnight its not all ops fault they cannot fix him by being better their responses to being abused are flawed but very human this is the kind of flaws that ongoing abuse will bring out in most of us,MLeek
this isnt enabling this is the misfiring of survival instincts and toxic coping techiniques after years married to an emotional abuser,MLeek
it doesnt get better for op until op gets out,MLeek
youre supposed to leave the man who is either so conflict adverse he is unwilling to admit when he hasnt done something or so maliciously and gaslighting abusive that he takes pleasure in manipulating you and making you suffer,MLeek
this is a big deal hes acting more like an unhinged prison guard than a partner,MLeek
at some point it stops mattering if he does this because he is weak and fearful and cannot admit when he has failed to do something or if he does this because he takes pleasure in abusing you the end result is the same,MLeek
hes a gameplaying numbnut divorcee who wants to be chased even as hes telling you that he is not available to be caught he wants to feel desired by you and others without actually having to offer anything of himself or do any of the hard work of being more than just nice,MLeek
just end contact there is nothing here for you but drama,MLeek
so all these people like each other more than they like you,MLeek
which sucks for you but isnt a fight you can win there is not letting these adults make their own choices there is only you deciding what relationships you still want to be in,MLeek
its not your flat youre not on the lease these other people the subletter and your girlfriend were invited by the person who does lease the flat you didnt do them an act of kindness it wasnt yours to give to them,MLeek
the core issue here is that your gf doesnt want to move in with you when you return shes not prioritizing living with you thats plenty of reason to decide the relationship cannot or should not continue but this narrative you have about other people taking advantage of you or victimizing you is nonsense they disappointed you is all you had a room in someone elses house and that someone else has invited others instead,MLeek
if you dont want to continue with your gf dont but drop the rest of this bullshit,MLeek
id consider it a rather serious red flag if a man used the word emasculating at me in anger because i had achieved personal success or experienced personal stress both of these are human things,MLeek
hes telling you he thinks his achievements and his stress and carry more meaning than yours because hes a guy and youre a girl this is a serious issue,MLeek
you need to stop building him up about his career and instead tell him plainly that he is not entitled to rip you down because of his own twisted ideas about women and men or his own negative feelings he needs to manage his feelings without explosions of anger or gendered insults those behaviors should be dealbreakers,MLeek
emasculating is not a word he should be using or even thinking when it comes to your career path or achievements,MLeek
yeah i dont get it,MLeek
my parents are rather happily married for 40 years they are both basically good people but they described their vows as sincere workable wishes which is the best way i think you can look at it and something i practice with my partner now its not a prison sentence its a promise to work hard and work first at this shared wish and also to stop working and go on wishing the best for one another if we find no amount of effort means we can stay in the partnership without being miserable,MLeek
yeah so friends speak once and then hold their peace or remove themselves,MLeek
that is how you deal with a serious concern about a friends choice in partner respectfully,MLeek
and ill happily agree for the second time they may be toxic and we cant know,MLeek
i dont think youre being the critical thinker you imagine you are,MLeek
but you do seem to be reflecting a common bias where a body you find undesirable is immediately associated with behaviour or personality you assume is undesirable as well there is nothing here that suggests op is an unreliable narrator while that is certainly possible there usually are tells i dont see any and you havent pointed any out,MLeek
your interpretation took way more assumptions than mine did,MLeek
all mine hinged on was the fiance not speaking up for his own choice to be with op clearly to his friends thats a pretty defensible take whether we completely accept ops reasoning or not fianc should still be standing up for his own choices  even if those choices are mistakes,MLeek
you really should consider why your story  the one where op must be toxic and the friends nobbling defending him from her  is the one you felt compelled to tell and doubled down on because it didnt require critical thinking or skepticism it required a rather fallaciousseeming leap,MLeek
the devil has plenty of advocates already and playing one doesnt actually make you seem interesting or insightful it just makes you sound like a motivated reasoner,MLeek
why do you want to imprison this man with a wife who resents him and doesnt want to be with him its not like thats a great deal for him either if op isnt able to willing to change the shared goals and expectations she has then he deserves to be free of her just as much as she deserves to be free of him,MLeek
and do you think people didnt walk away from their partners constantly in the previous centuries due to poverty or illness cause they did in droves sometimes with a bit of social shaming but far less than you might imagine men more than women which is not a comment so much on mens general character as it is their power and agency to leave a undesirable situations and seek greater comfort and convenience elsewhere,MLeek
its so funny how individualism went awry just the time as when women achieved the most basic human rights and the ability to leave situations they found intolerable,MLeek
no we dont get to dictate how others deal with objects or memories from experiences that were traumatic or abusive,MLeek
op can absolutely bring his feelings and needs forward but she doesnt have to do this because the ex was abusive if anything the fact he was abusive may contribute to her connection to objects that represent the positive aspects of the relationships because all abusers have some positive traits at times that is how they entrap,MLeek
it does to me,MLeek
but also these are very stupid and desperate criminals,MLeek
unlike the magic power to declassify documents by looking at them he retained that until the very last second and then some yes,MLeek
id recommend these things get put away in a drawer and from there you suck it up,MLeek
not because your feelings are irrational but because grief  especially grief and processing after long term abuse  are super fucking complicated,MLeek
you can ask her to do this work for you and your comfort that fair if its a thing you really need and boundaries you need to revisit but id recommend you not force the issue shes very likely to let go of more in time but two years after seven of abuse is not full processing time for most people,MLeek
shes probably not holding onto him shes preserving the story of her own life,MLeek
you shouldnt stay in a relationship you dont want to be in,MLeek
your husband needs to stop gettingseekingstaying at jobs where he is either not able to succeed or his work ethic doesnt line up with expectations,MLeek
becoming successful is not a reasonable expectation if that is what you need its probably time to walk away go date someone who already is,MLeek
becoming stable reliable and less miserable should be the shared goal and expectation of him if youre going to stay that may include a major change of industry andor changes in expectations about how he will contribute,MLeek
laugh,MLeek
and then hopefully wake up from the strange dream where my partner and my father are not both rational and civil men who can resolve disagreements and do not order me around like a dog,MLeek
we always just have ops pov they are frequently manipulating the internet for validating responses do you jump in on every thread to remind us of that fact or just the ones where you suspect the fatcard,MLeek
look if you think its not very probable that a group of people have deemed someone unworthy primarily due to their weight i do not know what universe youre living in cause it aint the one i inhabit,MLeek
ive happily agreed they may be toxic and we cant know but you seem to need more than that you should ask yourself why,MLeek
friends speak once and then hold their peace or remove themselves,MLeek
they dont speak about another persons body or level of perceived hotness as being a huge mistake,MLeek
while its possible these two are poorly matched or toxic there is nothing here to suggest it and fianc should still be standing up for his own choices  even if those choices are mistakes,MLeek
does it matter,MLeek
most of the time he kept talking about his friendsfamilycoworkers and exes and only asked about 3 questions about me the entire time,MLeek
and,MLeek
i was like no i dont kiss on the first date and we kept talking about it untill he leaned in and kissed me,MLeek
this man is a boundarybusting selfabsorbed asshat who is not relationship material,MLeek
unless youre just looking to get laid move on frankly even if you are probably want to be moving on a man that selfabsorbed and indirect in his communication is a coin flip odds are not great hes a fun lay anyways a guy who asks you nothing about yourself is rather unlikely to get you off,MLeek
dont so be desperate to be picked by somebody that you chase after selfish little shits who basically ignore you as a person realize you get to do the picking too  and then put this one back on the pile unless the earring is worth a small fortune let it go along with this guy,MLeek
i think the real issue here is your fiance is refusing to stand up for himself with the people he calls friends which is sad for him and it limits your life together,MLeek
basically he needs better friends or to tell these friends they are expected to be better or to gtfo,MLeek
no you probably shouldnt,MLeek
you should be speaking to a therapist about how to best move forward in your own life,MLeek
you still havent sorted out the difference between her doing something wrong and her doing something that disappointed you,MLeek
youre not expressing all that much love for her as a person but for the role you have cast her in and are frustrated she is no longer consenting to perform,MLeek
youre not owed a certain number of chances and your family as you previously envisioned it doesnt need to be back together that is your preference not a fact of the universe she doesnt have to agree she doesnt agree,MLeek
these attitudes all make it extremely unlikely that youve done the work you need to be an independent and reliable adult and even if you had done that work she might still not want to reconcile because youre not owed a certain number of chances she can just choose not to be in a marriage she doesnt want to be in and she has,MLeek
take these thoughts and feelings to a therapist they do need to be addressed but not by your exwife,MLeek
your mother is dating an asshole and what is worse she knows it and she appears to have quietly approved of his behaviour she warned you when she should have said if you are verbally abusive to my son in yourhis workplace i will dump your childish ass,MLeek
dont talk to him hes not relevant to you and if youre in a union situation you should seriously consider reporting him for threatening your workdayincome because hes pissed off you didnt buy him a meal,MLeek
tell your mother kindly but firmly that your invites do not include him unless you explicitly include him you need to avoid these misunderstandings in the future by being clear if he is coming or not,MLeek
even if he isnt cheating on you this isnt okay,MLeek
if hes not cheating on you then hes trying to punish you for forgetting to pay your bill during your time of crisis and grief,MLeek
you dont need proof hes cheating to get the fuck rid of him over this,MLeek
a person who tells you they are sooooooo nice and sooooooo loyal and no one else will treat you as well as they will is a completely trash person,MLeek
do not make peace with this,MLeek
do not marry this man,MLeek
this is a major warning sign,MLeek
he will abuse you,MLeek
then he will tell you its your own fault while declaring all other men are worse abusers than he is which is a lie he tells so he gets what he wants he wants to abuse you,MLeek
why not just block him thats perfectly acceptable and very clear response,MLeek
and if not that then you tell him to stop,MLeek
dude that sounds flirty i dont like it cut it out,MLeek
if he denies it or pretends its not or its no big deal dont argue with him just say good im glad thats not what you meant cut it out anyways i dont like it thanks,MLeek
its a bad idea to date someone in their 20s,MLeek
the age gap should bother you more than it bothers her and it should motivate you to make a responsible respectful choice based on your life experience,MLeek
to answer your questions generally i think dealbreakers prior the first date should be short and sweet and cover the really big things guns religion sex before marriage and abortion vegan diets if that is a big one for you those sorts of biggies the conversation about what could a relationship look like how much time will we spend together and where how do you see a relationship with your children developing is a conversation you have after 23 pleasant dates and you both agree you want to continue to see one another,MLeek
i mean it sounds like the guy is a sexist asshat you should reduce your time with,MLeek
its okay to decide not to invest in friendships with people if you dont like how they treat you or others,MLeek
stop being a bystander its gross if youre not going to call him out at least step away from him,MLeek
youre not,MLeek
you are not 5yearolds call dibs on the best ball as the bell rings,MLeek
you treated her like a human being,MLeek
hes treating you like a competitor in a sport where she is the favourite big red ball and he cant figure out how to dibs her,MLeek
keep her friendship reconsider his,MLeek
she wasnt that into you,MLeek
you were into her and kept hopingimagining she felt the same,MLeek
maybe she kinda liked you at some point but then she didnt,MLeek
there is no problem here just a normal disappointment,MLeek
the only thing youre doing wrong is refusing to accept this as a totally normal bit of normal human disappointment most of the people you like arent gonna like you back,MLeek
youre both being absurd and kinda gross,MLeek
this woman has told you shes not available for new connections at the moment,MLeek
he doesnt give a fuck he thinks this is a game to be won not a bunch of human people with feelings and free choices and youre acting like he bought her by driving you around and being your friend that is also pretty gross,MLeek
opt out of this bullshit when he makes passiveaggressive comments tell him hes being kinda unfriendly over this shit and to cut it out be a bro not a whiny brat you value his friendship but if hes gonna act like a 5th grader who called dibs on a girl who told him she isnt single anyways its gonna damage respect between you two as adult human beings,MLeek
if you dont want to keep speaking her then dont but this isnt about who falls in love more this is about not surrounding yourself with men who treat women as trophies and you as the competition its toxic af its not friendly,MLeek
when i see no drama my brain immediately translates it to i am the drama i bring the only permissible drama,MLeek
no drama is the poor cousin of all my exes are crazy i wouldnt say is guarantees gaslighting  that term is getting super inflated but it does mean they seek out and create toxic dynamics and at very best lack selfawareness,MLeek
yeah,MLeek
and you wont die cause you cant afford insulin or chemo or got in a car crash and your family wont loose the house andor all their savings trying to keep you alive,MLeek
everyone on the planet who gets this deal would fucking go to war against the us if they tried to export your the idea of a tiny bit less taxes but everything else is way fucking worse and only the millionaires benefit,MLeek
i literally do not know how so many americans wake up each day knowing they are one er visit away from total financial ruin,MLeek
tell me youre an adult man who wants a mommy without te nm fuck it,MLeek
you are loved and awesome,MLeek
he was telling a story telling a lie because his ego couldnt accept the rejection he couldnt handle the consequences for his bad behaviour he needed to tell a story where you unworthy of him so he didnt have ti address the fact he was clearly objectively unworthy of you,MLeek
its been years since i broke up with my ex and some of his nasty stories about me still slip into my life telling me im unworthy or im greedy or im dumb im shocked how many years later im fighting his narratives even though they were lies then and they are definitely lies now,MLeek
your brain it trying to make sense of someone you cared for and were vulnerable with telling you such terrible lies,MLeek
you end all contact you keep reminding yourself these were selfserving lies that had everything to do with his weakness and hatefulness and nothing to do with you as a person,MLeek
honestly the best thing to do is leave these conversations i tell them to google motivated reasoning and then go touch grass,MLeek
its not a data argument to begin with no data scientist would take these with anything short of a 10lb bag of street salt thats not even what average means this was a dataasmarketing for paid dating apps a decade ago apps that are selling a product to predominately straight men by convincing them they require a paid advantage,MLeek
marketing departments make graphs all the time that i roll my eyes at and say well that is technically not a lie thats all that is happening here,MLeek
are we talking oh that 18 year old has great emotional regulation expresses boundaries clearly while also being empathetic to those around her,MLeek
or do we mean shes a free baby sitter and chauffeur for younger siblings and isnt thats a great perk for her parents,MLeek
there are definitely ways to praise young women for being mature or wise that reflect their individual strengths and not their usefulnesssubmission to others,MLeek
irrelevant,MLeek
this would be a bit funny from a 21 one year old but its embarrassingly stupid from a man his age who wants to be a parent,MLeek
if ubi does happen ha and ai takes over significant parts of our world school will change a lot but children will still need to be educated in order to be people we want to share the world with and maybe even live fulfilling lives,MLeek
its pretty obvious this man just wanted you to shame her into handing the child over to you and then you would be responsible for the care of him and the child,MLeek
glad you escaped id suggest you be very very skeptical of anything he ever told you about her whatever her struggles are now clearly when they were together she had two babies to take care of and one of them was a resentful and manipulative shit of a 450months old,MLeek
i would not date a man who thought it was my job to sort out his parenting and custody issues with his ex thats insane,MLeek
he was being a shitty parent and trying to coerce you into doing the job for him this terrible attitude towards responsibility and work likely his assumptions about womens work was going to continue,MLeek
if he had won custody youd have basically been single parenting that infant can all but promise it breaking up over his lack of responsibility and blameshifting was completely wise and not at all petty,MLeek
then start with your obygn or a standard therapist and ask for a referral,MLeek
if youre serious about these concerns address them seriously addressing them seriously is not going to happen on reddit,MLeek
33 isnt an older father those studies usually begin at 35 to 40,MLeek
you should be talking to a doctor not google not reddit and not a sociopath,MLeek
i think trying to round your hall pass up into polyamoury before speaking to your wife is toxic as fuck swinging is completely and utterly different from poly most swingers will be the very first to tell you that  and makes me perfectly comfortable expecting better from this man hes not a novice he should have the basics down so trying to build a new relationship outside of the marriage for weeks without speaking to his wife thats taking it past poor communication about boundaries into a realm id consider manipulative and coercive,MLeek
i say this as a practicing enm person who has seen a lot of wellintentioned people mess it up this is not a mess up i could assume was wellintentioned experience has taught me that people who really want to take good care of all their partners and relationships arent this stupid this mess up would mean both of these people are outta my life forever they are not safe or reliable,MLeek
im not a fan of keeping such an open mind that ones brain falls right out the best ill give this man he was very conveniently confused and when someones confusion is that convenient to them and what they want for themselves trust is severely damaged,MLeek
if i heard hall pass id assume it was a onetime hook up thing so yeah hit it and quit it and i probably wouldnt want to participate in that sounds dicey and not what id want in an enm encounter,MLeek
but i really dont know what a hall pass was in this marriage and neither does op and apparently neither did these two thats kind of the whole problem and its not ops problem,MLeek
so this chad was a sorta awkward and totally ageappropriate teenage boyfriend right,MLeek
no one dates someone 20 years younger then them by accident or because they are looking for a relationship with and equal rooted in mutual respect,MLeek
warningprawit appears that you are using praw in an asynchronous environment,MLeek
it is strongly recommended to use async praw,MLeek
see  for more info,MLeek
you dont seem to be open to advice,MLeek
its reasonable for your gf to not want to marry you and live with your mom its reasonable for her not to want to marry someone who is planning on financially supporting his mother for the rest of her life,MLeek
it is strange that you find this surprising and its only coming up now,MLeek
